요청아이디,콘텐츠아이디,제목,주소,도로명주소,소개,변경사항
977,CONT_000000000501299,퍼시픽 리솜 엘마리노 뷔페,제주특별자치도 서귀포시 색달동 2950-5 ,,삼면이 바다 전망인 오션뷰 파노라마 뷔페,"1. 상세정보 내용 수정환상적인 제주 중문 바다를 보며 프리미엄 뷔페를 즐길 수 있습니다. 통유리 너머 마라도·가파도까지 보이는 광활한 뷰와 해넘이의 장관을 만끽할 수 있는 아름다운 공간입니다. 싱싱한 재료를 엄선하여 제철 회와 각종 해산물은 물론 고기국수, 돔베고기 등 제주 음식과 한식, 중식, 양식 등 다양한 메뉴를 제공합니다. 독립적인 다이닝 공간을 포함하여 200여 석의 쾌적하고 넓은 좌석이 마련되어 있습니다.2. 이용안내 탭 이용시간 수정런치 12:00~14:00 (마지막 입장 13:00)디너 18:00~20:00 (마지막 입장 19:00)*코로나19 영향으로 4월 한 달 간 적용되는 단축영업시간입니다."
978,CONT_000000000500465,퍼시픽 리솜 요트투어 샹그릴라,제주특별자치도 서귀포시 색달동 2950-5 ,,중문 앞 제주바다에서 즐기는 호화로운 요트 투어,"1. 상세정보 내용 수정아름답게 물든 바다와 하늘 사이, 바다 한가운데서 보는 일출과 일몰은 형용할 수 없는 감동을 선사합니다. 요트 위에서 짜릿한 손맛을 느끼고 갓 잡은 생선회를 맛봅니다. 주상절리를 매우 가까이에서 볼 수 있고, 요트 물살을 따라 헤엄치는 야생 돌고래와 만나기도 합니다. 바다수영, 스노클링, 프러포즈 등 별도의 특별한 요트 체험까지 가능합니다.2. 이용안내 탭 이용시간 수정- 이용시간: 퍼시픽 리솜 홈페이지 참고"
983,CONT_000000000500707,휴애리 자연생활공원,제주특별자치도 서귀포시 남원읍 신례리 2081 ,,자연속 동·식물들과 교감이 있는 체험형 자연생활공원,"이용안내 중상세정보 : 연중무휴 / 체험이용시간 감귤체험, 승마체험 이용시 17:00까지 입장해야 체험가능'이용시간' 삭제 , 이용시간 삭제 대신 - 입장마감 : 하절기(4월~10월) 17:30, 동절기(11월~3월) 16:30 "
986,CONT_000000000500707,휴애리 자연생활공원,제주특별자치도 서귀포시 남원읍 신례리 2081 ,,자연속 동·식물들과 교감이 있는 체험형 자연생활공원,"이용시간에 '평일 : 09:00 ~ 18:00 , 주말 : 09:00 ~ 18:00' 을 삭제해 주시고,이용시간 -> 입장시간으로 정정 부탁드립니다.입장시간 : 09:00 ~ 17:30 (4~10월), 09:00~16:30(11~3월)"
988,CONT_000000000500103,노루생태관찰원,제주특별자치도 제주시 봉개동 산 51-2 ,,제주의 야생 노루를 언제든지 가까이서 만날 수 있는 곳,"노루먹이주는 시간인 오전9시, 오후 3시 30분경에 방문하시면 더 많은 노루를 관찰할 수 있습니다.위 부분을 아래와 같이 수정하여 주십시요노루먹이주기 체험은 오전9시 부터 오후 3시30분 까지이며(노루 상태에 따라 조기 마감할 수 있음) 그 이후에는 노루를 구경 할 수만 있습니다."
989,CONT_000000000500707,휴애리 자연생활공원,제주특별자치도 서귀포시 남원읍 신례리 2081 ,,자연속 동·식물들과 교감이 있는 체험형 자연생활공원,금일(20.05.06) 부로 휴애리 승마체험이 종료되었습니다. 정보내 승마와 관련된 모든 사항을 삭제 부탁드립니다.
687,CNTS_200000000007999,제주치유숲 Global Ageing 치유농장,제주특별자치도 제주시 구좌읍 김녕리 731 ,,자양에 젖줄 찾아 떠나는 이들이 모여 지내는 곳.  고요하고 섬세한 속에서  잠시나마 머물며 스스로 찾는 시간이 있는 곳.,이곳은 위빳사나 명상하는 곳입니다.마음의 여러 현상 관찰하는 이들이 모여 좋아함  싫어함  성냄 등도 명칭을 붙이며.. 관찰하는 곳이며 고요함과 섬세함에서 온전히 스스로 당김과 닿음만이 분석을 통하여 알아차림 합니다. 
702,CNTS_000000000019729,한림공원매화축제,제주특별자치도 제주시 한림읍 협재리 2487 ,,아름다운 매화가 매서운 겨울 바람을 이겨내고 한림공원 매화정원에서 단아한 자태를 뽐냅니다.,"제 20회 제주의 봄 소식 한림공원 매화축제 일시 : 2019. 2. 1(금) ~ 2019. 2.28(목)새 봄! 봄의 전령사 매화를 만나보세요.  매화 · 수선화정원에는 버드나무처럼 늘어지는 80년생 능수매화가 장관을 이루며, 20년 이상 된 백매화, 홍매화, 겹백매화, 겹홍매화, 청매화 등이 만발하여  한림공원을 방문한 관광객들에게 제주의 봄소식을 전하고 있습니다.  한림공원 매화정원에서 고고한 매화의 기품과  수선화 향기와 함께 성큼 다가온 봄의 기운을 만끽해 보세요.   ※ 축제 프로그램   - 매화 정원 개장   - 매화 인증샷 이벤트   - 매화 분재 전시회   / 장소 : 제주 석 · 분재원   - 매화 시화전 / 장소 : 매화 정원 내   - 매화꽃차, 매화쿠키, 매화비누   / 장소 : 매화정원"
789,CNTS_200000000008631,2019 봄 시즌글라스 녹차 페스티벌 청초밭 제주,제주특별자치도 서귀포시 표선면 성읍리 2497 ,, 서귀포시 표선면 성읍리 일대 청초밭에 조성되어 있는 100만 평의 녹차밭에서 열리는 녹차 페스티벌. ,사진 변경 부탁드립니다!썸네일 사진은 아이 네명 손잡고 녹차밭 걷는 모습으로 변경 부탁드립니다 ^^ 감사합니다~ 
858,CNTS_000000000001158,메이즈랜드,제주특별자치도 제주시 구좌읍 평대리 3322 ,,"돌, 바람, 여자, 제주의 삼다를 녹인 미로공원","요금정보 성인 (대학생이상) : 11,000원청소년(중고생) : 9,000원어린이(36개월 ~ 초등학생) : 8,000원장애인(1-6급) : 5,000원"
873,CONT_000000000500283,산굼부리,제주특별자치도 제주시 조천읍 교래리 38 ,,"사계절마다 다른풍경의 '분화구 식물원', 국가지정 문화재 천연기념물 263호",길찾기 주소 신주소) 제주특별자치도 제주시 조천읍 비자림로 768 수정바랍니다
882,CONT_000000000500266,붉은오름자연휴양림,제주특별자치도 서귀포시 표선면 가시리 산 158 ,"제주특별자치도 서귀포시 표선면 남조로 1487-73 (가시리, 붉은오름 자연휴양림 숲속의 집) ",계절마다 각기 다른 아름다움을 뽐내는 붉은 오름 자연휴양림,
909,CNTS_200000000009393,메밀꽃을 보며 걸으며 생각하며,제주특별자치도 서귀포시 표선면 성읍리 3048번지 ,,넓고 아름다운 메밀 꽃길을 보며 걸어보며자연에 대한 감사와 자신을 생각해  보는 시간을 가질 수 있다.,청초밭 메밀꽃 축제가 11월 17일까지 연장되었습니다!내용 수정부탁드립니다^^ 
835,CNTS_200000000008895,차귀도유람선,제주특별자치도 제주시 한경면 고산리 3616-9 차귀도유람선,제주특별자치도 제주시 한경면 노을해안로 1161 (고산리) 차귀도유람선,차귀도 둘레길 탐방과 차귀도 경치 유람까지 동시에 즐길 수 있는 유람선,
837,CNTS_200000000008895,차귀도유람선,제주특별자치도 제주시 한경면 고산리 3616-9 차귀도유람선,제주특별자치도 제주시 한경면 노을해안로 1161 (고산리) 차귀도유람선,차귀도 둘레길 탐방과 차귀도 경치 유람까지 동시에 즐길 수 있는 유람선,상호명 차귀도 유람선 사이에 간격을 붙여주세요외국어 상호명을 위 상호명으로 변경해주세요
895,CONT_000000000501058,제주엠리조트,제주특별자치도 서귀포시 강정동 1938 ,,편백나무의 향과 편안함을 느낄 수 있는 제주엠리조트!! 다양한 부대시설로 가족/단체여행객에게 인기가 많습니다.,"1. 이용시간이 비어있네요    체크인 15:00          체크아웃 11:00   넣어주세요2. 언어서비스는 중국어_간체 지워주세요3. 편의시설은 조식당, 흑돼지고깃집, 노래방, 세미나실, 수영장(여름), 미니정원, 공용주차장, 전기차충전, 무료와이파이, 유도 및 안내시설, 경보 및 피난시설 등   으로 고쳐주세요4. 대표사진 자리에 ""1""이라고 써있는 사진파일을 올려주세요"
903,CNTS_200000000009393,메밀꽃을 보며 걸으며 생각하며,제주특별자치도 서귀포시 표선면 성읍리 3048번지 ,,넓고 아름다운 메밀 꽃길을 보며 걸어보며자연에 대한 감사와 자신을 생각해  보는 시간을 가질 수 있다.,이미지 추가 부탁드립니다 ^^ 
910,CONT_000000000500707,휴애리 자연생활공원,제주특별자치도 서귀포시 남원읍 신례리 2081 ,,자연속 동·식물들과 교감이 있는 체험형 자연생활공원,11월 15일 부터 2019년 휴애리 동백축제가 시작되었습니다. 기존 소개 내용 중 감귤이나 핑크뮬리 타이틀로 작성되어 있는것은 모두 동백축제로 변경 부탁드립니다. 첨부드린 이미지도 상단으로 추가해 주세요.
915,CONT_000000000500155,유기농 녹차 다희연,제주특별자치도 제주시 조천읍 선교로 115-1 캐릭파크내, 캐릭파크내,숲속바이크와 함께하는 녹차족욕  다희연,"주소를 ""제주시 조천읍 선교로 266 캐릭파크내"" 로 정정하여 주시기 바랍니다. "
916,CONT_000000000500625,초콜릿박물관,제주특별자치도 서귀포시 대정읍 일과리 551-18 ,,세계 10대 초콜릿박물관,"입장료 대인 7,000원 소인 5,000원"
924,CNTS_000000000020476,주상절리대(중문대포해안),제주특별자치도 서귀포시 중문동 2768-1 ,,자연의 신비가 주는 웅장함에 압도되다,"* 2019년 6월 1일 ~ 12월 31일, 노후 관람데크 해체 및 재설치로 부분통제노후테크 공사가 완료되어, 위 안내문구 삭제 요청드립니다."
937,CONT_000000000500141,더마파크,제주특별자치도 제주시 한림읍 월림7길 155 ,,세계최초의 말전문테마공원,요금 인상으로 인한 사진 교체 원합나다
939,CNTS_000000000020476,주상절리대(중문대포해안),제주특별자치도 서귀포시 중문동 2768-1 ,,자연의 신비가 주는 웅장함에 압도되다,"* 2019년 6월 1일 ~ 12월 31일, 노후 관람데크 해체 및 재설치로 부분통제위의 안내문구 삭제요청드립니다."
954,CONT_000000000500859,롯데호텔제주,"제주특별자치도 서귀포시 색달동 2812-4 (★우편번호 찾기가 안됩니다) 제주특별자치도 서귀포시 중문관광로 72번길 35, 롯데호텔제주로 변경 원합니다."," (★우편번호 찾기가 안됩니다) 제주특별자치도 서귀포시 중문관광로 72번길 35, 롯데호텔제주로 변경 원합니다.",사계절 온수풀과 이국적인 풍경이 매혹적인 리조트형 호텔,"[상세정보] 푸른 제주 바다와 하늘이 맞닿은 곳에 위치한 롯데호텔제주는 천국 같은 휴식과 여행의 즐거움을 동시에 누릴 수 있는 대한민국 대표 호텔이다. 총 500개의 객실 수와 제주의 따뜻한 바다를 닮은 사계절 온수풀 ‘해온(海溫)’, 멀티 놀이공간 ‘플레이토피아’, 헬로키티 캐릭터 룸과 풀빌라 스위트 룸, 연회장을 비롯해 미식 여행의 진수를 선사할 레스토랑까지 다채로운 시설들 보유하고 있다. 롯데호텔제주는 레저 전문 엔터테이너 ‘ACE(ACTIVE＆CREATIVE ENTERTAINER)'는 어린이를 위한 키즈캠프, 쿠킹 클래스부터 가족을 위한 야외 프로그램까지 계절별로 다양하게 제공한다. 그 외 '헬로키티 캐릭터 룸', '키즈월드', '키즈랩'이 마련된 키즈플로어와 2019년 12월 신규 오픈한 국내호텔 최대규모 '플레이토피아'는 익스트림 어린이 스포츠 클럽 챔피언 R, 패밀리 락볼링장, VR체험&아케이드존 공간으로 호텔을 방문한 가족 단위 고객에게 즐거운 추억을 선사한다. 2020년 1월 오픈한 'V SPA'는 프리미엄 안티에이징 스파 '발몽'과 프랑스 No.1 해양성 코스메틱 브랜드 '딸고' 테라피의 격조높은 서비스를 제공하며, 시즌에 따른 각종 패키지와 이벤트들이 마련되어 있다. 이 외에도 롯데호텔제주의 랜드마크인 풍차라운지, 키즈 플로어, 해변 산책로, 피트니스 클럽, 쇼핑 등 즐거운 추억을 간직할 수 있는 기회를 제공하고 있다."
685,CONT_000000000500690,한림공원,제주특별자치도 제주시 한림읍 한림로 300 ,,아름다움이 피어나는 사계절 공원,"2019년 입장요금개인 일반 12,000원개인 경로 10,000원개인 청소년 8,000원개인 어린이 7,000원단체 일반 10,000원단체 경로 9,000원단체 청소년 6,000원단체 어린이 5,500원"
2467,CNTS_200000000011475,쇼밥,제주특별자치도 서귀포시 색달동 1898-1 2층,제주특별자치도 서귀포시 색달로 99 (색달동) 2층,"쇼밥은 서귀포시내에 있는 뷰와 가성비 끝판왕 의 수비드, 소안심스테이크, 소천지형상의 블랙치킨, 파스타 등으로 유명한 곳이다.",
2491,CONT_000000000500689,한라수목원,제주특별자치도 제주시 수목원길 72 ,,숲이 주는 상쾌한 느낌을 만끽하는 도심 속 공원,이용시간변경실내외 전시원 및 산책로: 연중무휴 상시개방
2492,CNTS_000000000021169,세리월드 테마파크,제주특별자치도 서귀포시 법환동 877 ,,다양한 레포츠 체험을 동시에,이용요금변경체험별 금액 상이
2497,CNTS_000000000022135,루나폴,제주특별자치도 서귀포시 안덕면 덕수리 산27 ,,밤이 되어야 열리는 세계 최대 규모 나이트 디지털 테마파크,이용시간변경루나폴 19:00~24:00 (마지막입장 23:00)
721,CNTS_000000000022353,서귀포 다이브센터,제주특별자치도 서귀포시 남원읍 하례리 64-10 ,"제주특별자치도 서귀포시 남원읍 하례망장포로 65-13 (하례리, 하례리어촌계) ",헬멧을 하고 물속에 들어가는 씨워킹과 스쿠버다이빙을 체험할수 있는 곳,"이용금액 1. 씨워킹 80.000  할인금액  40.000  50% 할인2. 체험다이빙 10.000원  할인금액 55.000원3. 문섬 체험다이빙 12000원  할인금액 85.000(PADI 자격증코스)공인된PADI 트레이닝기관에 공식 등록된 서귀포 다이브센터입니다. 전문책임보험 가입된 업체로서 안전성과 다양한 경험 풍부한 경력을 갖춘 전문 프로 강사 팀으로 이루어 져있습니다.1.오픈워터 다이버코스 :  2박3일 지식개발 , 제한수역, 개방수역실습 특별할인가 550.000 원 정상가 700.000원포함사항: 숙박2박+중식+자격증발급 외 교육에 필요한 모든비용포함2.어드밴스드 오픈워터: 1박2일  5회다이빙  600.000원포함사항: 숙박1박+중식+자격증발급 외 교육에 필요한 모든비용포함기타 교육관련은 블로그 참고 해주세요   blog.naver.com/kny4176"
730,CNTS_000000000021920,가파도청보리축제,제주특별자치도 서귀포시 대정읍 가파로67번길 ,,안녕하세요 가파도정기여객선입니다. 수정요청 부탁드립니다.,청보기축제 수정 3.30일부터5.12일까지(42일간)모슬포항에서배로20분->운진항에서배로10분으로변경모슬포항<->가파항   운진항<->가파도상동항으로변경삼영해운지워주시구요 794-3500번호뻬주시고 064)764-5490~3 변경도항선아니고 여객선으로 변경 아름다운섬나라 주소는 신주소로 변경 최남단해안로120으로 변경배사진은 새로 보낸걸로 변경해주세요.
737,CNTS_000000000020683,윌라라,제주특별자치도 서귀포시 성산읍 성산리 178-10 ,,달고기와 상어고기로 만든 피쉬앤칩스를 맛볼 수 있는곳,"저희 가게는 말레이시아 무슬림 손님이 자주 많이 찾는 음식점으로 할랄 프렌들리, 혹은 무슬림 프렌들리로 카테고리 변경 요청드립니다."
741,CNTS_000000000001035,중화요리 사해방,제주특별자치도 서귀포시 중문동 1891-7 사해방,"제주특별자치도 서귀포시 천제연로 263 (중문동, 사해방흑돼지) 사해방",정통중화요리 전문점 / 중문대표맛집 / 아이들 놀이방 / 300명 단체석완비 / 넓은 주차장 / 픽업가능/ 배달가능  ,홈페이지 없어졌어요. 주소이전했어요.전화번호 738-7775/2262/4577/46774회선입니다 추가등록해주세요
743,CONT_000000000500690,한림공원,제주특별자치도 제주시 한림읍 협재리 2487 ,,10만 평 대지 위에 펼쳐지는 환상적인 10가지 테마파크,
744,CONT_000000000500690,한림공원,제주특별자치도 제주시 한림읍 협재리 2487 ,,hallimpark1971@gmail.com,사진이 한번에 10장이 업로드가 안되서 나눠서 신청합니다.
758,CNTS_000000000022623,제주베스트힐 열기구랜드,제주시 조천읍 남조로 2109-36 ,,줄을 묶어 안전하게 계류비행하는 열기구 체험프로그램,안내 연락처의 전화번호가 잘못되어있습니다 변경요청합니다
761,CONT_000000000500620,체오름,제주특별자치도 제주시 구좌읍 중산간동로 ,,"과거 일본군이 주둔했던 흔적이 남아있는, 말발굽형태의 비교적 큰 오름.","체오름 및 주변지역 소유주입니다.체오름 은 일반인에게 개방된 오름이 아닙니다.산악회와 관광객들로 인해 엄청난 피해를 겪고 있습니다.""체오름""은 ""사유지이며 무단출입금지지역"" ""무단출입시 민형사상 처벌됨"" 을 내용에 넣어주시기 바랍니다.LIKE FARM "
765,CNTS_200000000007312,탐라반상,제주특별자치도 제주시 한경면 저지리 3135-1 ,,"탐라반상의 요리는 제주의 자연으로부터 나옵니다,,제주 로컬푸드를 이용한 제주 힐링푸드 전문 레스토랑",외국인 손님들이 다양한 한국음식을 경험할 수 있는 건강 음식점입니다채식 자연식 건강식을 음식을 드시고 싶은 관광객들을 위한 음식점입니다
773,CNTS_200000000008631,2019 봄 시즌글라스 녹차 페스티벌 청초밭 제주,제주특별자치도 서귀포시 표선면 성읍리 2497 ,, 서귀포시 표선면 성읍리 일대 청초밭에 조성되어 있는 100만 평의 녹차밭에서 열리는 녹차 페스티벌. ,"-사진추가- 내용 변경:오는 5월 31일~6월 9일 열흘간 청초밭에서 '제1회 봄 시즌 글라스 녹차 페스티벌 청초밭 제주'를 합니다.축제가 진행되는 녹차밭은 1999년 약 20년 전 일반적 방식인 삽목이 아닌 직접 씨앗을 심었으며 자연순환농법으로 재배됩니다.아직 외부에 공개된 적이 없는 유기농 땅 녹차밭을 외부에 최초로 개방합니다.가이드와 함께하는 녹차 트래킹, 녹차 세미나, 녹차 토크쇼, 이벤트, 키즈 프로그램, 버스킹, 음악회 등  재미나고 풍성한 "
782,CNTS_000000000022860,휴애리 수국축제,제주특별자치도 서귀포시 남원읍 신례리 2081 ,,제주 속 제주 휴애리 수국과 함께하는 여행,*수국축제 일정 연장/변경 : 2019년 6월 2일 까지 -> 2019년 7월 14일까지  *소개사진 변경 : 첨부해 드린 포스터 및 사진으로 소개자료 변경 요청
785,CONT_000000000500405,쌍룡굴(한림공원),제주특별자치도 제주시 한림읍 협재리 2487 ,,한림공원 내에 위치한 두 마리의 용이 빠져 나온 것 같다고 하여 이름 붙여진 쌍룡굴,천연기념물등록된 명칭으로 변경요청입니다.기타 글 내용 쌍용굴 > 쌍룡굴로 수정부탁드립니다.
795,CONT_000000000500283,산굼부리,제주특별자치도 제주시 조천읍 교래리 38 ,,"사계절마다 다른풍경의 '분화구 식물원', 국가지정 문화재 천연기념물 263호","이용안내 - 요금정보 수정 요청입니다유료, 성인 6.000원/ 청소년,경로,장애인 4.000원/ 어린이 3.000원"
692,CONT_000000000500535,제주4·3평화공원,제주특별자치도 제주시 봉개동 237-2 ,"제주특별자치도 제주시 명림로 430 (봉개동, 제주4.3평화기념관) ",반드시 기억해야 할 우리 제주의 역사가 담긴 제주 4.3 평화공원,
750,CONT_000000000500405,쌍룡굴(한림공원),제주특별자치도 제주시 한림읍 협재리 2487 ,,한림공원 내에 위치한 두 마리의 용이 빠져 나온 것 같다고 하여 이름 붙여진 쌍룡굴,
769,CNTS_000000000022696,삼성혈해물탕,제주시 연동 312-27 ,,카메라를 부르는 비주얼에 시원하고 깔끔한 해물탕,"글 내용 중에 ""제주시 탑동에 본점, 연동에 2호점이 운영되고 있다"" 라고 적혀있는데, 잘못된 정보이므로 수정 요청 합니다.""제주시 연동에 본점, 도두1동에 도두점, 서귀포 혁신도시쪽에 서귀포점 총 3개의 매장을 운영하고 있다."" 로 변경 요청 합니다."
757,CNTS_200000000008531,선물고팡,제주특별자치도 제주시 용담이동 2745-1 ,,공항까지 무료셔틀을 지원하는 공항 인근 기념품숍. ,"제주공항 인근에 위치한 기념품 숍, 선물고팡.대형 매장 규모에 1,2층으로 구분되어 있어 1층에서는 제주도의 특산품을 2층에서는 디자이너 제작 핸드메이드 감성 소품 등을 구매할 수 있다.수산품, 축산품, 감성 소품 등 지인들에게 선물하기 좋은 다양한 종류의 기념품들이 구비되어 있으며 공항까지 무료 셔틀을 지원해 여행의 마무리를 짓기에 적합하다.  또한 옥상정원 및 2층 테라스에서 한라산 전경을 바라보며 이벤트 음료를 즐길 수 있다.------> 문구수정 부탁드립니다.제주공항 인근에 위치한 기념품 숍, 선물고팡은 대형 매장 규모에 1, 2층으로 구분되어 있습니다. 1층에서는 제주도의 특산품을 구입할 수 있고, 2층에서는 디자이너 제작 핸드메이드 감성 소품 등을 구매할 수 있습니다.농협중매인분들의 협동조합인 과일아삭협동조합에서 직영으로 운영하는 곳이라 제주과일은 가격도 품질도 당연히 믿을 수 있습니다. 또한 제주영농조합법인, 한림수협에서 축산품과 수산물을 납품받고 있습니다. 과일, 수산품, 축산품, 초콜렛, 식품, 주류, 제주 디자인의 감성 소품 등 지인들에게 선물하기 좋은 다양한 종류의 기념품들이 구비되어 있으며 공항까지 무료 셔틀을 지원해 여행의 마무리를 짓기에 적합합니다.  또한 렌트카 반납 후 전화주시면 픽업서비스가 가능합니다. 카페도 있어 상점 내의 옥상정원 및 2층 테라스에서 한라산 전경을 바라보며 음료를 즐길 수 있습니다. "
786,CONT_000000000500690,한림공원 부겐빌레아축제,제주특별자치도 제주시 한림읍 협재리 2487 ,,"신록의 계절 5월을 맞이하여 제주 한림공원에서는  열대지방에서만 볼 수 있는 부겐빌레아 꽃을  20여년 이상 온실에서 재배하여  제 2회 ‘부겐빌레아 꽃축제’를 개최합니다.    남미 브라질이 원산지인 부겐빌레아의 꽃말은 ‘정열과 사랑’으로 알려지고 있으며  빨간색, 분홍색, 보라색 등 화사한 꽃이 만발하여  관람객들의 눈길을 사로잡고 있습니다.    가정의 달을 맞이하여 부겐빌레아 꽃의 향연이 펼쳐지는  한림공원으로 관광객 여러분을 초대합니다.",
797,CNTS_000000000001191,생각하는정원,제주특별자치도 제주시 한경면 저지리 1534 ,"제주특별자치도 제주시 한경면 녹차분재로 675 (저지리, 생각하는정원) ",국가지정 민간정원으로 대한민국 대표정원,"생각하는 정원을 그냥 보고 가면 1/10을 얻어가는 것이고, 글까지 읽고 가면 7/10을, 생각을 품어 가면 열을 다 얻어 갈 것입니다. 생각하는 정원은 1968년부터 농부 성범영이 제주시 한경면 저지리의 황무지를 개척하여 집념으로 완성한 창조적인 정원으로 1만 3천평(43,000㎡)의 대지에 7개의 소정원으로 구성되어 있으며 ‘세계에서 가장 아름다운 정원’이라는 수식어와 함께 창조와 예술, 철학이 융합된 정원으로 국제적 탐구의 대상이 되고 있습니다. 유구한 세월을 간직한 한국 고유의 정원수와 분재 그리고 괴석과 수석이 잔디광장과 오름의 여백을 따라 전시되어 있으며, 돌 하나하나마다 손으로 직접 다듬어 쌓아 올린 거대한 화산석 돌담과 돌문, 그리고 곳곳에 쏟아져 내리는 폭포와 연못은 자연석 석조건물과 조화를 이루어 독창적인 한국정원의 모습을 갖고 있어 제주의 자연과 멋을 가장 잘 보여주고 있습니다.또한, 정원에서의 깨달음과 생각을 정리한 설명글들은 나무에 대한 이해와 사색으로 관람의 즐거움을 한층 더하고 있습니다."
833,CNTS_200000000008853,뚱보조개　,제주특별자치도 제주시 이도이동 1188-10 ,,제주의 해산물을 즐길수 있는 제철 해산물이 가득한 조개구이 전문점,#연포탕  # 해물탕  # 조개구이  로 가게 검색이 되는 것 같은데  # 연포탕  대신 # 생새우 오도리 소금구이  변경 부탁드립니다.참고로 제가 뚱보조개 사장입니다.  # 해물탕이랑 # 조개구이는 그대로 유지해 주세요.
