요청아이디,콘텐츠아이디,제목,주소,도로명주소,소개,변경사항
1571,CNTS_000000000022860,휴애리 봄 수국축제,제주특별자치도 서귀포시 남원읍 신례리 2081 ,,■ 일정 : 2022. 3. 25(금) ~ 5. 31(화)  ■ 개최장소 : 제주도 서귀포시 남원읍 신례동로 256(휴애리 자연생활공원)   ■ 주최 : 휴애리 자연생활공원  ■ 문의 : 064)732-2114,"내용 수정사항이 많아서 처음부터 새로 작성하고 보냅니다.행사 공연명 : 휴애리 봄 수국축제주최 : 휴애리자연생활공원문의 및 안내처 : 064-732-2114행사장소 주소 : 제주특별자치도 서귀포시 남원읍 신례동로 256행사기간 : 2022년 3월25일 ~ 2022년 5월31일흑돼지행진시간 : 11:00, 13:00, 15:00, 17:00 (하루4번)행사장소 : 휴애리자연생활공원 내행사홈페이지주소 : http://hueree.com행사소개오색빛깔 수국을 한 곳에서올 봄 가장 먼저 수국을 만나 볼 수 있어 ‘인기’서귀포시 남원읍 신례리에 위치한 휴애리 자연생활공원은 제주도민과 제주를 찾는 관광객에게 보다 나은 볼거리를 제공하고 또 힐링의 공간이 되고자 오는 3월 25일부터 “휴애리 봄 수국축제”를 개최한다고 밝혔다.이번 2022 휴애리 봄 수국축제는 정성스럽게 키운 다양한 수국을 온실, 수국정원, 등 공원 곳곳에서 감상할 수 있어 제주도민과 상춘객에게 인기가 좋은 제주 대표 봄 축제가 될 것으로 전망된다. 특별히 온실에서 다양한 수국을 올 봄 가장 많이 만나 볼 수 있으며 유럽수국까지 준비하여 늦여름까지 진행할 예정이다.전년도 보다 더 풍성하게 준비될 이번 휴애리 봄 수국축제는 신혼여행, 웨딩스냅, 우정스냅 등 인생사진 찍기 좋은 장소로 인정받은 제주여행의 필수 코스이다. 휴애리 관계자에 따르면 가족, 연인, 친구와 함께 다양한 수국포토존 에서 아름다운 추억을 만들 수 있을 것이라 전했다.휴애리 양지선 대표는 “제주를 사랑하는 도민들과 관광객들에게 색다른 볼거리를 제공하고자 풍성하고 아름다운 수국을 정성껏 가꾸고 보살펴 왔다”며 “특별히 올해는 더욱 다양하고 풍성한 수국을 즐길 수 있도록 준비하였다""는 포부를 밝혔다.한편 휴애리는 여러 해 전부터 지역사회 환원 차원에서 제주도내 장애인단체, 보육원, 양로원 등은 축제 때마다 무료입장(사전예약 필수)을 진행하고 있으며 도민과 관광객 가운데 3자녀이상(소인, 청소년) 입장료 50%할인행사를 별도로 진행하고 있다.행사내용  ■ 휴애리 봄 수국축제 일정 : 2020. 7. 20(월) ~ 9. 13(일)  ■ 개최장소 : 제주도 서귀포시 남원읍 신례동로 256(휴애리 자연생활공원)   ■ 주최 : 휴애리 자연생활공원  ■ 문의 : 064)732-2114프로그램  ■ 상철체험프로그램동물먹이주기체험(토끼,염소,말,닭,흑돼지등), 야생화 자연 학습체험, 전통놀이체험(돌탑쌓기, 투호던지기, 굴렁쇠 체험, 제기차기, 널뛰기 등)이용요금성인:13,000원/단체:11,000원/도민,장애우,유공자,경로우대:6,500원청소년:11,000원/단체:9,000원/도민, 장애우 :5,500원어린이:10,000원/단체:8,0000원/도민, 장애우 :5,000원단체 30인 이상경로할인은 65세 이상(신분증 제출)만 24개월까지는 무료입장세자녀 50%할인(자녀만 할인혜택, 고등학생까지)제주도민, 장애인, 군경은 반드시 신분증 및 증명서를 제시해야 합니다.할인정보 : 장애우, 유공자, 경로우대, 제주도민관람소요시간 : 90분축제수용인원 : 일 최대 3,000명 미만정보제공자 ：현승민 과장전화번호 : 064-732-2114팩스번호 : 064-763-1456 홈페이지 URL : http//hueree.com"
1642,CONT_000000000500171,마라도(마라해양도립공원),제주특별자치도 서귀포시 대정읍 가파리 600 ,,"난대성 해양 동식물이 풍부하고 경관이 아름다운 유인도 중에 국토 최남단인 섬, 천연기념물 제423호",상세정보 내용중 마라도등대 소개 내용에 주의 사항 추가 요청합니다.*마라도등대 공사로 2022가을전 관람불가
1646,CONT_000000000500160,돛오름(돝오름),제주특별자치도 제주시 구좌읍 송당리 산 3 ,,비자림을 안고 있는 돛오름,
1650,CONT_000000000500582,제주허브동산,제주특별자치도 서귀포시 표선면 표선리 2608 ,,"150여종 허브와 꽃을 만날 수 있는 허브동산, 밤이 즐거운 야간명소","연중무휴, 09:00~22:00 (매표마감 21:00) , 허브체험 족욕프로그램 정시마다 진행(마지막 체험 18:00), 비누체험과 아로마 테라피체험 비정기적으로 운영중(사전문의 필요)"
1660,CONT_000000000500700,화북비석거리,제주특별자치도 제주시 일주동로 ,,지방관리들의 치적을 기념하는 비가 많이 서 있는 거리,상기주소에 변경이 안되어 하기주소로 정정요청 부탁드립니다.[정정주소] 제주시 화북1동 4008 화북비석거리 
1666,CNTS_200000000011773,캐니언파크,제주특별자치도 제주시 연동 281-20 ,,"국내최대실내동물원테마파크, 부담없는 접근성! 제주공항 5분거리, 눈/비/바람에도 끄떡없는 실내관광지!",이용시간: 11:00 ~ 20:00 (입장마감 19:00) *매주 화요일 정기휴무
1573,CONT_000000000500023,갓전시관[임시휴관중],제주특별자치도 제주시 조천읍 남조로 1904 ,,문화유산을 배우고 체험하는 공간,
1575,CNTS_000000000020631,제주도립김창열미술관,제주특별자치도 제주시 한경면 저지리 2120-82 ,,물방울 화가로 불리는 김창열화백의 업적과 정신을 기리기 위해 설립한 제주도립 미술관,
1576,CONT_000000000500349,성산일출봉(UNESCO 세계자연유산),제주특별자치도 서귀포시 성산읍 성산리 1 ,,"바다위에 우뚝 솟아난 수성화산·유네스코 세계자연유산, 천연기념물 제420호, 올레1코스","상세정보: 07:00~19:00(매표마감 17:50)  매월 첫번째 월요일 휴관(단, 등하산교차로, 우뭇개 전망대, 우뭇개 해안은 무료개방)"
1577,CONT_000000000500019,감귤박물관,제주특별자치도 서귀포시 신효동 산 4 ,,"감귤에 대한 모든 것을 보고, 느끼고, 체험할 수 있는 박물관","[변경 전]현재 감귤박물관은 정부의 사회적 거리두기 방역 조치 사항을 준수하여 운영하고 있습니다. 방문 전에는 전화 등을 통해 이용 방법을 미리 확인해주시고, 마스크 착용, 입장 전 발열 체크, 방문 명부 작성 등 방역 지침도 준수해주시기 바랍니다.[변경 전]현재 감귤박물관은 정부의 사회적 거리두기 방역 조치 사항을 준수하며 운영하고 있습니다. 방문 전에는 전화 등을 통해 이용 방법을 미리 확인해주시고, 마스크 착용, 입장 전 손 소독 등 방역 지침을 준수해주시기 바랍니다."
1593,CNTS_000000000021401,발자국화석공원,제주특별자치도 서귀포시 대정읍 상모리 626-1 ,,천연기념물 제464호로 지정된 발자국 화석 공원,수장고 및 자료실 완공 2022.12월 말 예정
1597,CNTS_000000000020971,산양곶자왈,제주특별자치도 제주시 한경면 청수리 956-6 ,,제주의 옛 생활터전이 있는 곳,연락처변경 요청 매표소 ☎064-772-4229이용시간: 연중무휴- 동절기(11월~3월) 09:30~17:00 (입장마감 16:00)- 하절기(4월~10월) 09:30~18:00 (입장마감 17:00)본문 내용 중 :이용요금 이용시간 제외 필요합니다~~
1598,CONT_000000000500035,거믄여해안경승지,제주특별자치도 서귀포시 516로 ,,올레 7코스에 속하는 아름다운 해안경승지,주소변경 요청(검은여 쉼터) 서귀포시 검은여로2(토평동 475-2)
1608,CONT_000000000500178,해밀레스토랑,제주특별자치도 서귀포시 안덕면 상천리 산 78-1 ,"제주특별자치도 서귀포시 안덕면 산록남로 786 (상천리, 루체빌리조트) ",마파람이 시원한 마복이 오름,마복이오름 주변관광지 식당에 루체빌리조트의 '해밀레스토랑' 추가 요청 드립니다.
1614,CONT_000000000500150,북촌돌하르방미술관,제주특별자치도 제주시 조천읍 북촌리 976 ,,"숲, 만남, 그리고 평화. 제주의 자연과 문화 그리고 예술이 함께 어우러진 감성공간.",이용시간: 하절기(4월~10월): 09:00~18:00동절기(11월~3월): 09:00~17:00
1647,CNTS_000000000021943,사려니숲 에코힐링 체험,제주특별자치도 서귀포시 표선면 가시리 산 158 ,,1년에 딱 한 번 입산이 허용되는 물찻오름을 만나러 가는 길,유선 사전예약 접수일정(예정) : 5월 9일(월) ~ 6월 10일(금)-> 유선 사전예약 접수일정(예정) : 6월 2일(목) ~ 6월 10일(금)으로 변경 요청합니다.
1667,CNTS_200000000009894,에밀리파크,제주특별자치도 제주시 조천읍 신촌리 1615-2 ,,에밀리파크는 초콜릿 만들기부터 족욕 체험까지 한 곳에서 여러 즐거움을 얻을 수 있는 멀티 카페다. 이곳에서 만들 수 있는 초콜릿 종류도 다양하다. 초콜릿을 여러 가지 모양의 몰드에 넣어 굳히거나 크런키와 초콜릿이 범벅된 초코스틱 등 원하는 대로 골라서 체험할 수 있다.,*홈페이지 /연락처 결번으로 확인 (운영여부 확인 불가)
1680,CNTS_200000000008635,대유ATV수렵사격랜드,제주특별자치도 서귀포시 상예동 144 ,,110여만 평의 드넓은 대지에서 온몸으로 스릴을 느낄 수 있는 레저 스포츠.,
1681,CNTS_200000000007496,화조원,제주특별자치도 제주시 애월읍 납읍리 58 ,,다양한 새들과 작은 동물들과 교감할 수 있는 공간.,"유료,성인 개인 18,000, 성인 단체 14,000, 청소년 개인 16,000, 청소년 단체 12,500, 어린이 개인 14,000, 어린이 단체 11,000, 노인 개인 14,000, 노인 단체 10,500"
1682,CNTS_000000000020676,상효원,제주특별자치도 서귀포시 상효동 산 25 ,,제주의 자생식물을 볼 수 있는 수목원,3월~9월 09:00 ~ 19:00 10월~2월 9:00 ~ 18:00
1690,CNTS_000000000022082,제주불빛정원 테마파크,제주특별자치도 제주시 애월읍 유수암리 1083 ,,"아름다운 불빛 조형물과 따뜻한 모닥불, 자연과 휴식이 있는 매력적인 야경의 별이 빛나는 밤 아름다운 추억 테마파크","이용시간: 연중무휴,17:00~ 24:00 (입장 마감 22:00)"
1691,CNTS_200000000012470,카페물결,제주특별자치도 제주시 건입동 340-2 ,,"카페 물결은 제주항 인근 사라봉 중턱에 위치한 친환경 카페이다. 산지등대가 무인화되면서 유휴시설이 된 관사와 사무실, 정원 등을 제주해양수산관리단과 제주시건입동도시재생현장지원센터가 새롭게 조성해 만든 곳이다.","이용시간: 연중무휴, (하절기)09:00~19:30/(동절기)09:00~18:00 "
1695,CONT_000000000500514,일출랜드,제주특별자치도 서귀포시 성산읍 삼달리 1010 ,,제주의 생태·문화·체험 관광의 명소,맨 위쪽 메뉴및 기타설명 부분 아래 메인이미지가 해상도가 너무 낮아 보여 좀더 해상도가 높은 이미지를 첨부해드립니다~교체해 주시면 정말 감사하겠습니다^^ 잘부탁드립니다 수고하세요!
1698,CONT_000000000500118,다랑쉬오름(월랑봉),제주특별자치도 제주시 구좌읍 세화리 6 ,,4계절 색채가 뚜렷한 오름의 여왕,[주소정정 요청]-변경전: 제주시 구좌읍 세화리 6-변경후: 제주시 구좌읍 세화리 산6 OR제주시 구좌읍 세화리 2705 (주차장주소)*산6번지 주소로 검색이 안되어 요청드립니다~
1568,CNTS_200000000008011,느지리오름(망오름),제주특별자치도 제주시 한림읍 상명리 산 5 ,,한림 16절경 '상명망봉'에 ,"[추가]이용시간: 제한 없으나 일몰 전 이용 권장소요시간: 탐방로 2.2km(왕복30~40분, 난이도 중)편의시설: 화장실 有, 쉼터(정자)有, 정상 전망대,무료주차장"
1574,CNTS_200000000008628,미야즈클로젯 ,제주특별자치도 제주시 용담삼동 526-2 1층,"제주특별자치도 제주시 용마로4길 15 (용담삼동, 용마주택) 1층","제주 한복, 해녀복 대여점, 해녀스냅 사진, 한복 스냅 사진 체험 스튜디오","기존에 영문 페이지만 있는데요, 아래 수정 요청사항 드립니다. 사진과 영문 소개 글 그리고 기타 내용은 메일로 추가드립니다.<수정요청사항>1. 현재 영문 페이지 이름 및 카테고리 변경 2. 국문 페이지 신설 3. 국문 페이지와 영문 페이지 들어갈 소개 및 설명 내용은 각각 다릅니다. 각각 드릴께요.4. 국문페이지는 해녀복 위주로 사진 및 설명 들어갈 것이고요, 영문페이지는 한복 사진 및 설명 위주로 들어갈꺼에요"
1585,CNTS_000000000021515,큰노꼬메오름,제주특별자치도 제주시 애월읍 유수암리 산 138 ,,멋지고 시원한 전망과 바람에 일렁이는 억새를 만날 수 있는 곳,"[추가]이용시간: 일몰전 이용 권장 (입산통제기간 없음)소요시간: 등반 편도 약 1시간 (해발 833m) 난이도: 중상 (가파른 구간 있음)편의시설: 화장실 ,주차장 "
1587,CNTS_200000000012866,더비치하우스,제주특별자치도 서귀포시 성산읍 고성리 559-1 1층, 1층,Tropical Lounge Bar. Life is Better at The Beach.,영업시간 23시로 연장
1594,CNTS_000000000022724,피규어뮤지엄 제주,제주특별자치도 서귀포시 안덕면 상창리 1875-8 ,,"국내 최대규모의 피규어 뮤지엄, 피규어 취향저격 기프트샵",이용 시간10:00~18:00  (입장마감 17:30) 
1617,CNTS_200000000012866,더비치하우스,제주특별자치도 서귀포시 성산읍 고성리 559-1 1층, 1층,Tropical Lounge Bar. Life is Better at The Beach.,영업시간 12:00~24:00라스트오더 : 23:15브레이크타임 없음17:00 부터 노키즈존
1603,CONT_000000000500168,따라비오름,제주특별자치도 서귀포시 표선면 가시리 산 62 ,,"표선면 가시리에 위치한 따라비오름은 3개의 분화구(굼부리)와 6개의 봉우리로 이루어져 있다. 화산이 폭발할 때 분출된 용암은 부드러운 산세를 만들어냈고, 가을이면 오름을 뒤덮은 억새 군락이 장관을 이룬다. ","[추가]이용시간: 일몰전 이용권장소요시간: ①편도 약 20분, ②분화구둘레길산책시 왕복 1시간~1시간 30분 편의시설: 화장실 無"
1604,CNTS_200000000008312,캔디원,제주특별자치도 제주시 조천읍 선흘리 1776 ,,"국내 최대 수제 캔디 브랜드로 꼽히는 캔디원은 사탕이 생겨난 유래와 종류, 제작 과정 등을 알아보고 직접 만들어 보는 색다른 체험을 하는 곳이다. 물론 제품 구입도 가능하다. 사탕을 좋아하는 사람에게 캔디원은 참새 방앗간이나 다름없다.",
1606,CNTS_000000000018504,마라도등대,제주특별자치도 서귀포시 대정읍 가파리 642 ,,동중국해와 제주도 남부해역을 오가는 선박들이 육지초인표지,내부 공사로 관람 불가
1612,CNTS_000000000018521,신대산전망대,제주특별자치도 제주시 추자면 예초리 ,,신대산에 있는 전망대,
1613,CONT_000000000500138,대정향교,제주특별자치도 서귀포시 안덕면 사계리 3126-1 ,,서귀포시 안덕면 사계리에 있는 조선시대의 향교,이용시간: 10:00~18:00
1619,CONT_000000000500281,사려니숲길,제주특별자치도 제주시 조천읍 교래리 산 137-1 ,,"제주 숨은 비경 31, 삼나무 향기에 취하며 걷는 아름답고 청정한 숲길",탐방방법 추가- 사려니숲길 탐방시 음식물 반입 금지- 플라스틱 물병은 안내센터 옆에 분리수거함이 있으니 사용바람. 
1641,CNTS_200000000007377,효명사,제주특별자치도 서귀포시 남원읍 하례리 산 45 ,,한라산 중턱에 위치한 소박한 사찰,연락처 정보 추가 요청  효명사 ☎064-733-4950
1683,CNTS_200000000011133,"그대, 나의 뮤즈 : 클림트 to 마티스",제주특별자치도 서귀포시 안덕면 서광리 산 24 제주신화월드 서머셋클럽하우스 ,,서양 미술사 거장 4인의 작품을 한자리에서 만나볼 수 있는 체험형 미디어아트!,
1699,CNTS_000000000019309,성읍랜드,제주특별자치도 서귀포시 표선면 성읍리 2045-1 ,,"성읍랜드는 카트와 ATV를 타고 누비는 액티비티 명소다. 화려하게 꾸민 분홍색 외관을 비롯해 아기자기한 카페, 사진 찍기 좋은 포토존을 두루 갖추고 있어 즐기는 재미가 두 배다. 유명한 연예인들이 다녀간 흔적도 벽면에 즐비해 마음이 더욱 설렌다. 몇 년 전 이곳에서 그룹 빅뱅과 에이핑크가 뮤직비디오를 찍기도 했다.","연중무휴, 카트 09:30~18:00 (입장마감 17:00), ATV/승마체험09:30~17:00 (입장마감 16:00)"
1700,CONT_000000000500580,해녀박물관,제주특별자치도 제주시 구좌읍 상도리 3204-1 ,,바당의 어멍 제주해녀의 삶을 느낄 수 있는 곳,"09:00~18:00 (매표마감 17:00)*매주 월요일, 1월1일/설날/추석당일 휴무"
1701,CNTS_000000000019758,조안베어뮤지엄,제주특별자치도 서귀포시 대포동 1959 ,,테디베어 아티스트 조안오 디자이너가 직접 만든 테디베어를 다양한 테마로 전시,"연중무휴, 9:00~17:00 (매표마감 16:15)"
1582,CNTS_000000000019566,수산저수지,제주특별자치도 제주시 애월읍 수산리 1 ,,높다란 곰솔나무가 지켜주는 저수지,"기존부터 진입 금지인 홍수부지 바깥쪽 둘레 조경 공사 중, 공사일정은 2022.12월까지 예상, 공사 부근 경계선 표시 할 예정임/저수지 외곽길은 방문 가능"
1586,CONT_000000000500232,백약이오름,제주특별자치도 서귀포시 표선면 성읍리 산 1 ,,"하늘로 향하는 길, 백약이오름","[추가]소요시간: 탐방 왕복 약30~40분 (정상둘레길 탐방시 약 30분 추가)난이도 : 중편의시설 : 화장실 없음, 탐방안내소 없음"
1600,CNTS_200000000010956,스누피가든,제주특별자치도 제주시 구좌읍 송당리 2303-3 ,,스누피가든은 개성적인 모습을 자랑하는 피넛츠 캐릭터들을 만나 그들과 상호관계를 통해 공감과 힐링의 메시지를 얻을 수 있는 특별한 장소이다.,65세이상 30%할인 이 20%로 변동 되었습니다. 
1607,CONT_000000000500178,마복이오름,제주특별자치도 서귀포시 안덕면 상천리 산 62-3 ,,마파람이 시원한 마복이 오름,마보기 오름 사진 추가 요청 드립니다.
1637,CONT_000000000500565,아쿠아플라넷 제주,제주특별자치도 서귀포시 성산읍 고성리 127-3 ,,450여종의 바다생명체가 있는 아시아 최대 수족관,"유료, 종합권 : 성인 40,700원, 경로 / 청소년 38,900원, 어린이 36,900원 // 미구엘 슈발리에 전시권 : 성인 17,000원 / 경로,청소년,어린이 13,000원위 요금으로 요금정보 수정 부탁드립니다."
1651,CNTS_000000000021055,천지연기정길,제주특별자치도 서귀포시 서홍동 961-34 ,,천지연 폭포를 눈에 담을 수 있는 길,주소가 검색되지 않아 여기에 요청드립니다. 기존: 제주특별자치도 서귀포시 서홍동 961-34정정요청 주소: 제주특별자치도 서귀포시 서귀동961-33
1656,CNTS_200000000010801,질그랭이센터,제주특별자치도 제주시 구좌읍 세화리 3641-10 ,,"구좌읍 세화리 마을주민 477명이 모여 만든 세화마을협동조합이 멋진 풍광의 세화리 바닷가에 질그랭이센터를 오픈했다. 지상 4층 규모로 건축된 질그랭이센터는 1층은 세화리사무소가 업무를 보는 공간이고, 2층에는 카페와 로컬푸드 판매점, 3층은 구좌읍주민여행사와 여행자센터를 갖추고 있다. 4층은 여행자들의 쉼을 위해 마련된 숙소로 코로나19 추이를 지켜보며 운영될 예정이다.","소개내용 수정 요청 (변경전) 1층은 세화리사무소가 업무를 보는 공간이고, 2층에는 카페와 로컬푸드 판매점, 3층은 구좌읍주민여행사와 여행자센터를 갖추고 있다. 4층은 여행자들의 쉼을 위해 마련된 숙소로 코로나19 추이를 지켜보며 운영될 예정이다.(변경후)층은 세화리사무소가 업무를 보는 공간과 여행자센터가 있고, 2층에는 카페와 지구별가게, 3층은 공유오피공간과 세미나실이 있어 대관하고 있으며 4층은 세화밖거리(숙박시설)를 갖추고 있다."
1657,CONT_000000000500237,범섬,제주특별자치도 서귀포시 법환동 ,,면면이 기괴한 자태의 신비함을 간직한 섬,상세정보 內 주의사항 추가 요청2022년 1월부터 섬 주변 해역도 출입제한 지역으로 낚시 및 해상 레저 이용 시에도 반드시 허가 필요함 
1658,CONT_000000000500200,문섬(서귀포해양도립공원),제주특별자치도 서귀포시 칠십리로 ,,섬에 아무것도 자라지 않는 민둥섬이라서 붙여진 이름의 섬,상세정보 內 주의사항 추가 요청2022년 1월부터 섬 주변 해역도 출입제한 지역으로 낚시 및 해상 레저 이용 시에도 반드시 허가 필요함 
1659,CONT_000000000500067,국립제주박물관,제주특별자치도 제주시 건입동 261 ,,동북아시아 문화교류의 거점인 제주도 역사와 문화의 전당,"이용시간 수정 및 사회적거리두기 완화로 인원제한 해제되어 주의사항 문구 삭제 요청합니다.(변경전)평일 : 10:00 ~ 18:00 , 주말 : 10:00 ~ 18:00(변경후) 09:00~18:00"
1670,CONT_000000000500568,제주유리의성,제주특별자치도 제주시 한경면 저지리 3135-1 ,,국내 최대 규모의 유리 조형예술체험 테마파크,"이용안내 요금 정보 일부 수정성인11,000원/ 장애인/경로/청소년9,000원 으로 수정요청합니다."
1671,CONT_000000000500292,산천단,제주특별자치도 제주시 아라1동 392-3 ,,우리나라에서 가장 오래된 노목인 곰솔과 함께한 산천단의 역사,이용시간 수정 요청합니다.이용시간: 없음(일몰전 관람 추천)
1678,CNTS_200000000010057,레드우드하우스,제주특별자치도 제주시 구좌읍 종달리 1075 ,,개인욕실이 있는 1인실 전문 원룸형 게스트하우스,
1693,CNTS_200000000012059,노형수퍼마켙,제주특별자치도 제주시 해안동 2137-1 ,,"리가 사는 세상과 또 다른 세상을 연결 시켜주는 잃어버린 문, 1981년 어느날 노형수퍼마켙에 이 불안정한 문이 열려 제주의 색을 모두 빨아들인다. 문의 힘이 점점 커지면서 수퍼마켙조차 색을 잃어버렸지만 수퍼마켙의 중심엔 빨아들인 색깔들로 인해 이 세상에서는 볼 수 없는 신비로운 광경이 펼쳐지고 있다. 어쩌면 유치하지만, 한편으론 유쾌하고, 마지막에는 신비로움이 느껴지는 수퍼마켙 세상으로 들어가 보자.",
1694,CONT_000000000500270,비자림,제주특별자치도 제주시 구좌읍 평대리 3161-1 ,,천년의 세월이 녹아든 신비로움 가득한 비자림은 500~800년생 비자나무들이 자생하는 세계적으로도 희귀한 장소다. 벼락 맞은 나무부터 긴 세월이 느껴지는 아름드리 나무까지 다양한 비자나무를 만날 수 있다. ,새 천년 비자나무 명명 비석에 영어 오류가 발견됩니다.813 year-old  --> 813-year-oldspirtual --> spiritualproperity --> prosperity
1702,CONT_000000000500579,제주항일기념관,제주특별자치도 제주시 조천읍 조천리 1156 ,,제주인의 독립의지를 고스란히 담고 있는 성지,"09:00~17:00(16:30 입장마감) *휴무: 1월1일,설날연휴(3일),추석연휴(3일)"
1569,CNTS_200000000011653,동해미락,제주특별자치도 서귀포시 서귀동 72-1 ,,"횟감좋은 서귀포횟집 동해미락, 바다전망! 푸짐한 해물모듬 활어회 코스요리, 다금바리, 갈치, 고등어회","영업시간을 평일 : 11:30 ~ 23:00 , 주말 : 11:30 ~ 23:00 로 수정부탁드립니다."
1605,CNTS_200000000012073,영등할망 신화공원,제주 제주시 한림읍 귀덕11길 19 ,,영등할망신화공원은 귀덕포구에서 해변을 따라 현무암으로 만들어진 좁은 돌길을 따라 약 1km 정도 이어진다. 길을 따라 걸으며 제주 신화를 알아보는 재미도 느껴보자.,
1616,CNTS_000000000021089,제주양떼목장,제주특별자치도 제주시 애월읍 납읍리 114 ,,숲 속의 통나무 집에서 양들과 교감할 수 있는 가족 체험목장,이용시간: 10:00 ~ 18:00 (입장마감: 17:00) 
1625,CNTS_200000000012866,더비치하우스,제주특별자치도 서귀포시 성산읍 고성리 559-1 1층, 1층,Tropical Lounge Bar. Life is Better at The Beach.,1. 영업시간15:00 ~ 24:002. 브레이크타임 없음.3. 20:00 부터 노키즈존
1495,CONT_000000000500336,제주아트서커스 (구 제주서커스월드) ,제주특별자치도 서귀포시 안덕면 동광로 214 ,,국내 최초로 선보이는 7인 여전사 오토바이쇼,
1511,CONT_000000000500050,고근산(고공산),제주특별자치도 서귀포시 서호동 1302-1 ,,눈앞에 펼쳐지는 범섬 앞바다의 장관,기본정보 연락처 변경전(+82) 064-760-3031 -> 기본정보 연락처 변경후(+82) 064-760-2913
