요청아이디,콘텐츠아이디,제목,주소,도로명주소,소개,변경사항
2475,CONT_000000000500540,제주국제평화센터,제주특별자치도 서귀포시 중문 관광로 227-24 ,,세계 평화의 섬 이미지 구현의 구심점 역할,상세정보: 운영시간 : (동절기 11월~2월) 09:00~17:00(입장마감 16:30) / (일반 3월~10월) 09:00~18:00(입장마감 17:30)
2494,CNTS_000000000000970,제주추사관,제주특별자치도 서귀포시 대정읍 안성리 1661-1 ,,"추사 김정희는 1840년 윤상도 옥사사건에 연루되어 약 9년간 제주에서 귀양살이를 했다. 대정읍에 있는 추사관은 김정희 선생이 유배 생활을 하며 남긴 흔적을 모은 곳이다. 그가 살았던 초가집도 옛 모습 대로 복원되어 있다. 추사관에는 김정희 선생이 쓴 현판 글씨와 아내, 지인들에게 보낸 편지 등이 전시되어 있다.","상세정보 추가내용침수복구중으로 실내 관람불가,야외 유배지만 관람가능 (12월중 복구완료예정)"
2502,CNTS_000000000019747,제주다원 녹차미로공원,제주특별자치도 서귀포시 색달동 산 50 ,,하늘과 바다가 맞닿은 지상최고의 전망과 신이 연출한 대자연 속 녹차미로공원에와서 차한잔의 여유를 즐겨보자.,"이용시간:  동절기(11월~1월) 09:00~17:00 / 하절기 09:00~18:00     이용요금: 성인 9,000원 / 청소년 7,000원/ 어린이(만 36개월이상~초등) 6,000원"
2510,CNTS_300000000015852,목장카페 밭디,제주특별자치도 서귀포시 표선면 성읍리 2867 ,,말 먹이주기 체험이 가능한 목장카페,"이용시간: 매주 수요일 휴무, 09:00~18:00 로 변경 부탁드립니다"
2548,CONT_000000000500034,거문오름(UNESCO 세계자연유산),제주특별자치도 제주시 조천읍 선흘리 478 ,,대한민국 유일의 세계자연유산 거문오름,"상세 정보매주 화요일 휴무 / 전화예약 및 인터넷 예약은 탐방 희망 전 달 1일부터 선착순으로 이뤄지고, 당일 취소자발생시 현장대기후 매표가능"
2559,CNTS_300000000012837,동쪽송당 동화마을,제주특별자치도 제주시 구좌읍 송당리 2635-3 ,,구석구석 포토존이 가득한 테마 공원,"이용시간: 연중무휴, 09:00~20:00 변경 요청드립니다"
2685,CONT_000000000500651,테디베어사파리 테지움,제주특별자치도 제주시 애월읍 소길리 155-106 ,,"테디베어와 동물인형들을 직접만져보고,안아보고 함께 사진찍을수있는 체험형 오픈전시관","<상세정보, 이용시간 변경 요청>1. 상세정보[변경 내용]연중무휴, 09:00 ~18:30 ( 매표마감 17:40), 하절기/동절기 상이2. 이용시간[변경 내용]평일 : 09:00 ~ 18:30 , 주말 : 09:00 ~ 18:30"
2687,CONT_000000000500356,세계조가비박물관,제주특별자치도 서귀포시 서홍동 557-1 ,,바다 속 아름다운 조가비 세계를 엿볼 수 있는 곳,"<상세정보, 이용시간 변경 요청>1. 상세정보[변경내용]연중무휴 09:30~18:30 (17:30 입장마감/ 변동가능, 유선 확인 후 방문 必)2. 이용시간[변경내용]평일 : 09:30 ~ 18:30 , 주말 : 09:30 ~ 18:30"
2688,CNTS_000000000022135,루나폴,제주특별자치도 서귀포시 안덕면 덕수리 산27 ,,밤이 되어야 열리는 세계 최대 규모 나이트 디지털 테마파크,"이용시간: 연중무휴 루나피크닉 10:00~17:00, 루나폴 19:00~24:00 (마지막입장 23:00) *브레이크타임 17:00~19:00이용요금: - 루나피크닉: 성인(20세이상) 10,000원, 청소년(14~19세) 9,000원, 어린이(36개월~13세) 7,000원- 루나폴: 성인(20세이상) 22,000원, 청소년(14~19세) 20,000원, 어린이(36개월~13세)17,000원* 공통적으로 36개월 미만 유아 무료입장, 도민 및 65세이상 20% 할인적용변경요청드립니다."
2707,CNTS_000000000019444,비블리아성서식물원,제주특별자치도 제주시 한림읍 상명리 1191-5 ,,식물을 통한 복음전파와 기독교 문화 산업에 기여하고자 한립음에 조성된 식물원,상세정보 하절기(3~10월):09:00~18:00 / 동절기(11~2월): 09:00~17:00  *1시간전 입장마감
2739,CNTS_000000000020127,한국야구명예전당(야구박물관),제주특별자치도 서귀포시 강정동 1481-3 ,,한국 야구의 살아 숨 쉬는 백과사전,안녕하세요~  한국야구명예전당 담당자입니다^^  최신 사진으로 업데이트 부탁드립니다~
2741,CONT_000000000500270,비자림,제주특별자치도 제주시 구좌읍 평대리 3161-1 ,,천년의 세월이 녹아든 신비로움 가득한 비자림은 500~800년생 비자나무들이 자생하는 세계적으로도 희귀한 장소다. 벼락 맞은 나무부터 긴 세월이 느껴지는 아름드리 나무까지 다양한 비자나무를 만날 수 있다. ,"*본문내용 변경요청*[변경전]숲 속 이야기가 궁금하다면 탐방해설사 프로그램에 참여해보자. 10시부터 15시까지 매정각시간마다 (10시, 11시, 12시, 13시, 14시, 15시) 입구에 있는 탐방해설 대기 장소에서 출발한다. 비자림에 자라는 다양한 식물과 숨은 이야기를 들을 수 있다. 해설 프로그램은 무료이며 1시간 이상 소요된다.[변경후]세계자연유산해설사를 통해 숲 해설을 들을 수 있으나, 운영 시간이 유동적이므로 유선 확인 필요"
2748,CNTS_200000000014074,코사이어티 빌리지 제주,제주특별자치도 제주시 구좌읍 송당리 2656 ,,워케이션에서 비롯하는 새로운 시각,코사이어티 빌리지 제주  -> 공간7로 명칭변경 홈페이지 주소 변경되었습니다
2753,CNTS_300000000012854,용연구름다리,제주특별자치도 제주시 용담이동 454-1 ,제주특별자치도 제주시 흥운길 73 (용담이동) ,제주의 은은한 야경을 느낄 수 있는 곳,주소 및 연락처 변경
2577,CONT_000000000500527,점보빌리지,제주특별자치도 서귀포시 안덕면 평화로 319번길 31-11 ,,제주속 작은 동남아 점보빌리지 코끼리테마쇼,"2023.12.01~ 공연장 리모델링으로 휴관, 공사 약 3개월 간 진행 예정주의사항으로 상기 내용 추가 요청합니다"
2603,CONT_000000000500581,제주향교,제주특별자치도 제주시 용담일동 298-8 ,,조선시대 지방민의 교육을 위해 세운 국립교육기관,"-현재 제주향교는 향교 내 계성사 건물 공사의 영향으로 제주중학교를 통해서만 진입 가능하며, 외관 감상만 가능합니다. 또한 단체 방문도 불가하니 방문시 참고 바랍니다. (내용삭제) -상세 정보09:00~17:00"
2608,CNTS_000000000019446,금능석물원,제주특별자치도 제주시 한림읍 한림로 176 ,,똑같이 생긴 하르방만 본 여행객들에게 제주 석물의 진수를 감상할 수 있게 하는 곳,"[요금정보 변경 요청]유료,성인 6.000원 / 학생,장애인,군인,도민,국가유공자,경로(70세 이상) 5,000원 / 어린이 7세 이하 무료"
2609,CNTS_200000000010333,파파빌레,제주특별자치도 제주시 조천읍 와흘리 165-8 ,,‘파파빌레’는 드넓은 공간에 다양한 제주의 땅속 현무암의 모습을 보여주는 돌을 소재로 한 관광지다,*반려동물 동반가능 *1~2월은 기상악화로 운영중단 으로 변경 부탁드립니다.
2616,CONT_000000000500569,렛츠런팜제주,제주특별자치도 제주시 조천읍 교래리 산 25-2 ,,"제주 렛츠런팜은 국내 경주마를 육성하고 관리하는 목장이다. 200만㎡가 넘는 면적에 마사와 교배소, 동물병원, 조교용 주로 등을 갖췄다. ",[민원 요청 건]소개 내용 중 두번째 단락 내용 수정 요청트렉터 마차 투어(3월~10월)외 목장 내 자율적으로 탐방 불가 / 견학 프로그램 운영 중단/목장 내부 방문 원할경우 사전 유선 확인 후 이용
2667,CONT_000000000500654,토이파크,제주특별자치도 서귀포시 안덕면 동광리 383 ,,국내외 진귀한 장난감이 모여 있는 꿈동산,"홈페이지 주소 및 이용시간 변경연중무휴, 10:00~19:00 (입장마감 18:20)"
2692,CNTS_000000000021906, 한라산청정고사리축제,제주특별자치도 서귀포시 남원읍 한남리 산 76-7 ,,생명이 움트는 청정 남원읍의 자연과 함께 즐기는  한라산청정 고사리 축제,"기   간 : 2023. 04. 13(토) ~ 4. 14(일) / 2일간 으로 수정 부탁드리며,아래 주요프로그램, 리플렛은 우선 삭제 부탁드립니다.추후 프로그램,리플렛 디자인이 확정이 되면 다시 요청드리겠습니다.감사합니다."
2724,CNTS_000000000019535,제주레포츠랜드,제주특별자치도 제주시 조천읍 와흘리 870 ,,"일반 카트장의 3배 크기, 국제경기유치가 가능한 국내최대규모카트장",이용시간: 연중무휴 09:00~18:00 (일몰시간에 따라 탄력운영) 변경요청드립니다
2740,CNTS_000000000021531,엉알해안산책로,제주특별자치도 제주시 한경면 고산리 3616-10 ,,화산재가 쌓여 이루어진 웅장한 지층과 낙조가 아름다운 산책로,"상제정보 추가내용2024.04.17부터 산책로 화산쇄설층 사면 일부구간 붕괴로 일부구간 통제 - 수월봉쪽입구 (정자,진지동굴)방면 진입통제 /  당분간 차귀포구쪽 입구로 일부구간 탐방가능 "
2752,CNTS_000000000022282,디스커버제주,제주특별자치도 서귀포시 대포동 760-3 ,,지금껏 알지 못했던 제주를 발견하고 사람을 만나는 여행,▶야생돌고래탐사 - 환경단체와의 문제로 당분간 휴업
2770,CNTS_000000000022885,주정공장(동척회사) 옛터,제주특별자치도 제주시 건입동 918-32 일대 ,,4.3사건 당시 수용소로 활용한 동양척식주식회사 제주주정공장.,"명칭변경: 주정공장수용소4.3역사관(주정공장옛터역사기념관)홈페이지 없음연락처변경이용시간: 09:00~18:00 (입장마감 17:00) *휴관: 2째,4째 월요일/1월1일/설,추석 연휴3일간 "
2772,CONT_000000000500568,제주유리의성,제주특별자치도 제주시 한경면 저지리 3135-1 ,,국내 최대 규모의 유리 조형예술체험 테마파크,
2784,CONT_000000000500604,중문색달해수욕장,제주특별자치도 서귀포시 색달동 3039 ,,"제주올레 8코스, 여유롭고 이국적인 해수욕장",제주관광정보센터입니다.예래동사무소 요청건으로 중문색달해변 전화번호 변경 요청드립니다~(기존) 064-738-4843 (변경후)064-739-4993
2787,CNTS_200000000014628,유동룡미술관,제주특별자치도 제주시 한림읍 월림리 115-161 ,, 건축가 겸 아티스트 유동룡의 흔적을 따라가며 ‘나의 오리지널리티’를 발견하는 곳,"<상세정보 수정 요청>관람시간 : 10~18시 (입장마감 17시)/ 매주 월요일 휴관, 1월 1일, 설, 추석 당일입장료 : 네이버 예약 사이트 확인 바람 (사전예약 필수)"
2788,CNTS_000000000021943,사려니숲 에코힐링 체험,제주특별자치도 서귀포시 표선면 가시리 산 158 ,,1년에 딱 한 번 입산이 허용되는 물찻오름을 만나러 가는 길,"<본문 내용 수정 요청>[변경 전]사려니숲 에코힐링 체험- 기  간 : 2022년 6월 9일(목) ~ 6월 12일(일) 총 4일간- 프로그램 * 물찻오름 입구 사전예약자 대상 개방 : 10:00~12:30 *30분간격 탐방 (1일 6회/회차당 20명 제한) * 기  타 : 개막식 공연/ 인증샷 이벤트 기념품증정/ 숲속힐링명상프로그램 1일 2회(10:00/14:00)등 * 유선 사전예약 접수일정 : 6월 2일~(예정)- 문  의 : 사려니숲길위원회(한라일보, 064-750-2291)[변경 후]사려니숲 에코힐링 체험- 기  간 : 2024년 6월 14일(금) ~ 6월 18일(화)- 프로그램 * 물찻오름 입구 사전예약자 대상 개방 : 10:00~12:30 *30분간격 탐방 (1일 6회/회차당 20명 제한/1인 최대 4명 예약) * 기  타 : 개막식 공연/ 한남시험림 한시 개방 등 * 유선 사전예약 접수일정 : 6월 4일 09:00부터 선착순 유선 예약(평일 09:00~18:00 *점심시간 12:00~13:00)- 문  의 : 사려니숲길위원회(한라일보, 064-750-2291)"
1913,CONT_000000000500624,초콜릿랜드,제주특별자치도 서귀포시 색달동 2864-36 ,,"초콜릿을 테마로 만든 전시관, 초콜렛 만들기 체험 가능",*홈페이지 주소 변경요청 [변경전] www.chocolateland.kr [변경후] https://booking.naver.com/booking/5/bizes/30275
1919,CNTS_000000000022076,제주이야기,제주특별자치도 제주시 구좌읍 행원리 542-7 ,,"천연꽃 화장품, 향수, 디퓨저를 직접 만들어 볼 수 있는 카페","페이지 메인의 대문 사진이 자꾸 바뀌어 있습니다. 지금 노출되는 사진이 아니라, 보내드린 사진으로 올려주세요.샘플처럼 해주시면 됩니다. 그리고, 해시태그도 바꾸고 싶습니다.#제주도선물 #제주도기념품 #제주이색체험 #천연화장품만들기 #화산송이로 바꾸어주세요. 감사합니다."
1969,CNTS_000000000019852,조천비석거리,제주특별자치도 제주시 조천읍 조천리 ,,"조천은 제주성과 가까운 곳으로 교통수단을 해로에 의존할 당시 목사나 판관 등 많은 관리가 화북, 조천 포구를 이용하였으므로 이들에 대한 치적과 석별의 뜻을 표시하기 위하여 비석을 세웠는데 이 거리를 통칭하여 비석거리라 한다.",
1972,CNTS_200000000008831,제주사랑방(제주책방),제주특별자치도 제주시 일도일동 1243-1 ,,누구나 이용할 수 있는 제주사랑방(제주책방),"이용시간: 12:00~20:00, * 법정공휴일 휴관(일요일 제외이나 기타 공휴일과 겹치는 경우 휴관) "
2380,CNTS_000000000020871,싱계물 공원,제주 제주시 한경면 신창리 1322-1 ,,싱계물 공원,"[편의시설 내용 변경 요청]공용주차장, 음료대, 장애인화장실(주차장 내)"
2386,CONT_000000000500690,한림공원,제주특별자치도 제주시 한림읍 협재리 2487 ,,10만 평 대지 위에 펼쳐지는 환상적인 10가지 테마파크.,홈페이지주소변경
2390,CONT_000000000500599,존자암지,제주특별자치도 서귀포시 하원동 산 1-1 ,,제주도 서귀포시 하원동 볼래오름 기슭에 있는 옛 사찰 존자암의 자리,연락처 수정 요청합니다.
2391,CNTS_000000000021429,다이나믹메이즈,제주특별자치도 서귀포시 표선면 성읍리 2381 ,,"다이나믹메이즈는 날씨에 구애받지 않고 즐기는 실내 액티비티다. 요즘 인기인 ‘방탈출’과 비슷한 콘셉트로 미로를 빠져나오기 위해 여러 가지 미션을 수행해야 한다. 가족이나 친구, 연인과 한 팀이 되어 서로 머리를 맞대 문제를 풀고 장애물을 뛰어넘으며 탈출구를 향해 달리는 색다른 재미를 느낄 수 있다. ","연락처 및 요금정보 변경요청합니다.(기존) 064-787-8774유료,다이나믹메이즈 14,000원, 다이나믹메이즈+레벨2 19,000원""(변경)☎064-805-0906/ 0910유료,다이나믹메이즈 16,000원, 다이나믹메이즈+레벨2 21,000원"""
2396,CNTS_300000000016084,라이더스랩,제주특별자치도 서귀포시 성산읍 삼달리 1768 라이더스랩 ,,"제주도의 특별함을 담은 승마장이다. 이 곳만의 고사리 곶자왈 코스에서 돌담길과 고사리밭, 소나무숲까지 이어진 특별한 코스를 즐길 수 있다.",기존 사진 지우고 새로 등록요청드립니다.
2401,CNTS_200000000010957,새별프렌즈 (새별헤이요목장),제주도 제주시 애월읍 봉성리 4554-20 ,,"새별오름 인근에 위치한 새별헤이요목장은 알파카, 말, 당나귀, 염소, 양들과 만날 수 있는 목장이다. 귀여운 동물친구들과 즐거운 추억을 만들어보자.","이용요금 변경대인,소인 15,000원/국가유공자/군인8,000원/제주도민12,000원 *36개월 미만 무료"
2402,CONT_000000000500693,함덕해수욕장,제주특별자치도 제주시 조천읍 함덕리 산14-1 ,,에매랄드처럼 빛나는 '한국의 몰디브',"반려동물 동반 관련 문구이며  본문에 추가 요청합니다. 민원이 다수 발생하는 사항으로 본문 상단에 강조해주시면 감사하겠습니다.* 해당 내용은 월정해수욕장 제외, 지정 해수욕장에 전부 동일하게 해당되는 내용으로 아래 첨부된 해수욕장 상세 정보에 모두 기재 부탁드립니다.[지정해수욕장]이호테우해수욕장 / 곽지해수욕장 / 협재해수욕장 / 금능해수욕장 / 화순금모래해수욕장 / 중문색달해수욕장 / 표선해수욕장 / 신양섭지해수욕장 / 김녕해수욕장 / 함덕해수욕장 / 삼양해수욕장[추가 문구]반려동물의 경우, 해수욕장 개장 기간 내 지정 해수욕장 유영 구역의 입욕은 통제됩니다.또한 입수객 등의 민원이 발생하거나, 현장 상황에 따라 반려동물 동반을 제재하는 상황 발생할 수 있으니 참고 부탁드립니다."
2317,CONT_000000000500079,금능해수욕장,제주특별자치도 제주시 한림읍 금능리 2036-1 ,,"제주시 한림읍에 위치한 금능해수욕장은 서쪽의 인기 명소인 협재해수욕장과 바로 이어져 있다. 파란 물감을 풀어놓은 것 같은 바다부터 생김새가 귀여운 비양도, 촉감이 보슬거리는 모래사장까지 이웃한 해변과 비슷한 풍경을 품고 있지만 그보다 사람이 붐비지 않아 여유로운 것이 매력이다. ","상세정보란 개장시간 변경 요청드립니다.[변경전]해수욕장 개장 시간 상이. (금능 종합상황실: 064-728-3983)[변경후]해수욕장 개장시간 23.06.24~08.31, 10:00~19:00 *야간개장없음 (금능 종합상황실: 064-728-3983~4)"
2319,CNTS_000000000018362,선운정사,제주특별자치도 제주시 애월읍 봉성리 3608 ,,"불교문화와 제주문화의 만남, 아름다운 야경을 자랑하는 선운정사",[본문 내용 추가]2023년 빛마루 축제(야간조명) 미운영(추후 운영재개 계획 없음)
2320,CNTS_000000000022715,성클라라수도원 금악성당,제주시 한림읍 금악리 373 ,,성클라라수도원에 부속된 성당,연락처 변경 요청
2321,CNTS_200000000009031,윈드1947 카트 테마파크,제주특별자치도 서귀포시 토평동 1799 ,,제주도의 아름다운 남쪽 풍경을 품은 제주 최고의 체험형 테마파크,"[이용시간 변경]비수기 : 10:00 ~ 18:00 , 5~9월 : 10:00 ~ 19:00*운영 종료 30분 전 티켓 마감"
2325,CONT_000000000500604,중문색달해수욕장,제주특별자치도 서귀포시 색달동 3039 ,,"제주올레 8코스, 여유롭고 이국적인 해수욕장",2023년 종합상황실 연락처 변경되어 수정요청합니다
2336,CONT_000000000500545,민속자연사박물관,제주특별자치도 제주시 일도2동 996-1 ,,제주민속자연사박물관은 제주 사람들이 오랜 세월 지켜온 전통문화와 자연 환경을 깊이 들여다보고 이해하는 공간이다. 볼거리가 많고 내용이 알차서 관람 시간을 넉넉히 잡는 것이 좋다. 제주 신화의 발상지인 삼성혈과 이웃해 함께 둘러보면 편하다. ,"상세정보 삭제요망편의시설 - 유모차 및 휠체어 무료대여(매표소: 유모차5대, 휠체어7대 / 안내데스크: 유모차2대, 전동휠체어1대) - 물품보관소: 무료(매표소건물 뒤쪽 18개+대형2개)<문화관광해설사> - 문의처: (예약)매표소 ☎064-710-7711 - 운영일자: 2022.01.25~12월 중순 - 이용시간: 10:00~17:00 *휴무:민속자연사박물관 휴관일과 동일   * 정기해설: 10:00 11:00 13:00 14:00 15:00 16:00   * 소요시간: 30분~1시간"
2338,CNTS_200000000008314,포레스트 사파리,제주특별자치도 제주시 조천읍 선흘리 1817 ,,조천에 위치한 동물원 테마파크.,"상세정보 변경이용시간 : 10:00~17:20 (매표마감: 16:20) *연중무휴 (폭설,태풍 제외하고 유선 연결 안되어도 운영시간내 이용 가능)/이용요금 : (입장료) 성인 12,000원, 어린이 11,000원(24개월이상~초등학생), 도민 1,000원 할인"
2341,CONT_000000000500677,하도해변,제주특별자치도 제주시 구좌읍 해맞이해안로 ,,수심이 얕아 어린아이들도 물놀이 하기 좋은 동쪽의 작은 해변,
2382,CNTS_200000000010477,함덕잠수함(이고제주),제주특별자치도 제주시 조천읍 함덕리 3294 ,,"우리가족,연인끼리만 이용하는 신비로운 바다속 체험, 잠수함과 요트를 동시에!",이용시간 변경요청드립니다.   ->  평일/ 주말  09:30 ~ 18:00 (30분 간격 운영)
2383,CNTS_000000000022691,오라동 청보리-메밀꽃밭,제주특별자치도 제주시 오라2동 산 76 ,,한라산 아래 드넓은 청보리-메밀꽃의 향연,"오라동 메밀밭 관리 기간 거친 후 9월 중순 이후 가을 메밀밭 조성예정으로 확인됩니다.기본정보 - 연락처 : 농업회사법인 오라 ☎064-711-9700 요금정보 - 이용요금: 성인 3,000원 / 초등생까지 2,000원 / 무료입장: 36개월 미만 유아 & 75세 이상 어르신 수정 요청 드립니다."
2408,CNTS_200000000010815,김택화미술관,제주특별자치도 제주시 조천읍 신흥리 227-5 ,,화가 김택화이 삶과 작품을 볼 수 있는 미술관,"변경요청1.본문에 있는 하기내용 삭제김택화미술관은 현재 내부공사로 임시휴관 중입니다. 방문할 예정이 있으신 분들은 사전에 전화 등으로 운영여부를 꼭 확인해주시기 바랍니다.2.상세정보에 있는 하기내용 삭제이용요금 : 유료,성인 7,500원 청소년,군인 6,000원 어린이,노인 4,500원, 성인(제주도민) 6,000원 청소년,군인(제주도민) 5,000원 어린이,노인(제주도민) 4,000원 5세이하,장애인,국가유공자 무료3. 이용시간에 하기내용 추가요망* 야간개장: 2023.08.11~09.03 중 금/토/일 10:00~21:00- 야간개장기간 매주 금요일: 밤의도슨트 진행(사전예약必/입장료 포함 30,000원)"
2340,CONT_000000000500466,용눈이오름 [출입제한 - 자연휴식년제 적용 중],제주특별자치도 제주시 구좌읍 종달논길 ,,"능선의 아름다움을 뽐내는 오름, 김영갑 작가가 사랑한 오름",제목 수정 요청합니다. 용눈이오름[출입제한 - 자연휴식년제 적용 중]-> 용눈이오름
2349,CNTS_000000000019120,해뜨는집,제주특별자치도 서귀포시 성산읍 오조리 3-14 ,"제주특별자치도 서귀포시 성산읍 한도로 137 (오조리, 해뜨는집펜션) ",강중훈 시인이 운영하는 펜션,"업체명과 기본정보가 뜨는 가장 상단 사진은 [해뜨는집_메인]상세정보(주황색 라인) 바로 아래 사진은 원래 사진 유지,소개글 아래 사진은 파일명 [해0~해5] 순서로 변경 부탁드립니다! 궁금하신 사항이 있으시면 꼭 신청자 연락처로 연락 부탁드리겠습니다. 감사합니다."
2359,CONT_000000000500933,성산풀하우스,제주특별자치도 서귀포시 성산읍 신산리 594-3 ,제주특별자치도 서귀포시 성산읍 환해장성로121번길 21-4 (신산리) ,"성산일출봉, 우도에 가깝고 바닷가가 보이는 독채형 펜션입니다.",
2374,CNTS_000000000022118,중문미로파크,제주특별자치도 서귀포시 상예동 3600 ,,중문미로파크는 중문에 위치한 미로테마파크입니다.,이용시간 : 09:00~18:00 *하절기(7~8월) 09:00~20:00
2442,CNTS_200000000011995,김한미술관 & 카페3206,제주특별자치도 제주시 한림읍 상대리 3206 ,,함경북도가 고향인 서양화가 김한(1928~2013)의 유작과 유품들을 전시해 놓은 미술관과 카페.,"변경전 : 이용시간 평일 : 10:00 ~ 20:00 , 주말 : 10:00 ~ 20:00변경후 : 미술관 10:00~18:00 (마지막 입장: 17:00, 카페 마감시간에 따라 유동적), 카페 10:00~20:00 *매주 화요일 휴무"
2501,CONT_000000000500568,제주유리의성,제주특별자치도 제주시 한경면 저지리 3135-1 ,,국내 최대 규모의 유리 조형예술체험 테마파크,
2504,CNTS_200000000012470,카페물결,제주특별자치도 제주시 건입동 340-2 ,,"카페 물결은 제주항 인근 사라봉 중턱에 위치한 친환경 카페이다. 산지등대가 무인화되면서 유휴시설이 된 관사와 사무실, 정원 등을 제주해양수산관리단과 제주시건입동도시재생현장지원센터가 새롭게 조성해 만든 곳이다.",이용시간: (하절기)09:00~19:30/(10월~3월)09:00~18:00(마감)
2505,CNTS_000000000022082,제주불빛정원 테마파크,제주특별자치도 제주시 애월읍 유수암리 1083 ,,"아름다운 불빛 조형물과 따뜻한 모닥불, 자연과 휴식이 있는 매력적인 야경의 별이 빛나는 밤 아름다운 추억 테마파크",
2518,CONT_000000000500550,제주러브랜드,제주특별자치도 제주시 연동 680-26 ,,성을 주제로 한 현대적 감각의 테마조각공원,*상세정보 수정 요청[변경 전]연중무휴/ 매표 마감 21:30[변경 후]연중무휴/ 매표 마감 21:00
2867,CNTS_200000000010435,제주고산리유적,제주특별자치도 제주시 한경면 고산리 3650-1 ,,"우리나라! 신석기시대  최초(最初), 최고(最古), 최애(最愛) 유적, 제주 고산리 유적!", 이용시간 변경 09:00~17:00
2873,CONT_000000000500559,제주세계자연유산센터,제주특별자치도 제주시 조천읍 선교로 569-36 ,,대한민국 최초의 세계자연유산으로서의 상징성을 위해 기념된 곳입니다,
