요청아이디,콘텐츠아이디,제목,주소,도로명주소,소개,변경사항
1774,CNTS_000000000018143,라마다프라자제주호텔,제주특별자치도 제주시 삼도이동 1254 ,,언제 어디서나 바다가 보이는 풍경 호텔. ,"안녕하세요. 라마다프라자 제주호텔 홍보담당 이보람입니다.지금 현재 올라가있는 콘텐츠 내용과 사진 수정 요청드립니다.사진이 여러개라 이미지로 순서 알려드리겠습니다.상세내용 수정에서 사진 위치도 적어놨으니 보시고 궁금하신 점 있으시면 언제든지 연락주십시오!감사합니다 : )<이용시간 수정>Checkin : 15:00~  Checkout : ~12:00<사진 순서>1. 해안도로전경이라는 이름으로 되어있는 전경사진 (D-_Design_Backup_2018년-카렌다_해안도로전경_GM.jpg)2. 객실사진(침대있는) (121-11111.jpg)3. 야외수영장 (SSZ_2210.jpg)4. 식당사진 (SSZ_3145.jpg)5. 연회장사진(예식) (KSS_0674.jpg)<상세정보 수정>(사진 1 추가)북유럽의 초호화유람선(SILJA LINE)을 모티브로 독특하게 설계하여 그에 따른 디테일한 컨셉이 살아 있는 내외부 인테리어 가지고 있으며,지상 9층, 지하 1층 400개 객실의 규모를 갖추고 있는 고품격 리조트형 멀티 플렉스 호텔입니다.(사진2, 사진3 추가)또한 공항에서는 10분, 제주항에서는 5분 정도의 가까운 거리로 지리상 강점을 갖추었을 뿐 아니라,라마다프라자 제주호텔이 위치한 탑동은 조선시대부터 제주의 옛 도심이었던 공간으로 독특한 문화거리와 다양한 로컬 맛집,아티스트들의 작업공간들이 모여 새로운 문화거리가 조성되고 있으며, 동문시장, 관덕정, 용두암 등 제주 문화유적지들이 가깝게 위치해있어비즈니스 고객뿐 아니라 가족 고객들에게도 안성맞춤인 위치적 강점을 가지고 있다.제주의 바다를 바로 마주하고 있는 위치와 특색 있는 고품격 인테리어, 산과 바다를 만끽할 수 있는 다양한 타입의 객실과 세미나,회의, 결혼식 및 각종 연회 등 1,500여명을 수용할 수 있는 그랜드볼룸을 비롯해 크고 작은 중.소 연회장을 갖추고 있어우아하고 품격 높은 연회가 가능하며, 바다가 보이는 루프탑 수영장, 선상 레스토랑 같은 분위기에 뷔페 레스토랑 등특색 있는 부대시설들이 다양하게 갖춰져 있어 라마다프라자 제주호텔만의 특별한 서비스를 경험을 하실 수 있다.(사진 4, 사진 5 추가)"
1776,CNTS_200000000010341,수목원테마공원(야시장길&LED공원),제주특별자치도 제주시 연동 1320 ,,"수목원테마파크 소나무 군락지에서 열리는 야시장은 다른 야시장과는 분위기가 사뭇 다르다. 숲 속을 밝힌 LED 조명과 푸드트럭, 프리마켓, 포토존마다 아기자기한 콘텐츠가 넘친다. ",하절기 기간 이용시간: 09:00~20:00 (마지막 입장 19:00)
1788,CNTS_000000000019305,정의향교,제주특별자치도 서귀포시 표선면 성읍리 820-1 ,,제주특별자치도 서귀포시 표선면 성읍리에 있는 조선시대의 향교,
1844,CNTS_200000000013907,야원,제주특별자치도 제주시 조천읍 대흘리 1197-56 야원,제주특별자치도 제주시 조천읍 번영로 1218 (대흘리) 야원,제주카페 야원,"[상세설명 내용 수정요청합니다.]제주카페 야원은 제주의 숲(곶자왈)에 제주의 초가집으로 지어진 카페이며, 제주의 전통 옹기 1000여 개 보존되어 있는 문화적 가치가 있는 곳 제주옹기정원 야원이다. 제주카페 야원은 주위에  함덕해수욕장, 에코랜드, 교래자연휴양림, 돌 문화공원이 인접해있다."
1889,CNTS_000000000019601,돈내코유원지,제주특별자치도 서귀포시 상효동 1460 ,,시원한 폭포와 상록수림으로 둘러 싸인 매력적인 곳,상세 정보 삭제요청돈내코 원앙폭포로 가는 나무데크 공사예정으로 10월중까지 관람 불가-> 공사완료로 관람가능 
1893,CONT_000000000500564,제주실탄사격장,제주특별자치도 서귀포시 상예동 2802 ,,제주유일 실내 권총실탄사격장,상세 정보이용시간 : 09:00 ~ 20:00(입장마감)
1905,CNTS_000000000022076,제주이야기,제주특별자치도 제주시 구좌읍 행원리 542-7 ,,"천연꽃 화장품, 향수, 디퓨저를 직접 만들어 볼 수 있는 카페","수정해주셔서 감사합니다.그러나, 오류가 있어 다시 수정 요청합니다. 번거롭게 해드려서 죄송합니다.본페이지의 대문이미지가 예전사진으로 되어 있습니다. (no_main_samlpe 참조)보내드린 jejuiyagi_main으로 OK_main_sample 처럼 간판타이틀이 우측에 잘 맞게 저렇게 수정해주시면 감사하겠습니다.감사합니다."
1933,CONT_000000000500336,제주아트서커스,제주특별자치도 서귀포시 안덕면 동광로 214 ,,국내 최초로 선보이는 7인 여전사 오토바이쇼,"상세정보변경1일 3회 (10:30,15:00,17:00) *매월 1회 휴무이나 휴무일 유동적 이므로 매월 확인필요"
1934,CONT_000000000500336,제주아트서커스,제주특별자치도 서귀포시 안덕면 동광로 214 ,,국내 최초로 선보이는 7인 여전사 오토바이쇼,"요금정보 변경유료,대인 22,000원, 청소년 20,000원, 소인 18,000원"
1938,CNTS_200000000008003,동백포레스트,서귀포시 남원읍 신례리 1767 ,,사진찍기 좋은 신례리 동백나무 군락지,■이용안내 변경 요청이용시간 → 10:00~18:00 (17:30 입장마감) *시즌별 상이함상세정보 → 상세문의 인스타 DM으로 가능
1939,CONT_000000000500156,동백동산,제주특별자치도 제주시 조천읍 선흘리 산 12 ,,조천읍 선흘리에 위치한 동백동산은 제주 생태체험관광의 또 다른 명소이다. 화산 폭발 후 흘러내린 용암이 쪼개지면서 형성된 곶자왈은 넓은 연못이 만들어지기에 어려운 구조다. 하지만 용암이 식을 때 부서지지 않고 판형으로 남아있는 지형에서는 물이 빠져 내려가지 않고 고여 있게 된다. 이를 ‘파호이호이용암’이라 부르며 제주에서는 동백동산이 유일하다.,"■이용안내 란 수정요청상세정보 : 설날,추석 당일 휴무, 오전 9시 이전 입장가능하나 일출 후 이용권장이용시간 : 동절기(11~3월)09:00~17:00 (입장마감16:00) / 하절기(4~10월)09:00~18:00 입장마감(17:00) *일몰시간에 따라 변동"
1941,CNTS_000000000022262,동산농원 딸기체험장,제주특별자치도 제주시 한경면 저지리 1448-2 ,,제주시 한경면 저지리에 위치한 딸기체험장,전화번호 변경 요청 및이용안내 > 상세정보 란에 [사전예약 필수] 라는 문구가 기재되면 좋을 것 같습니다~
2107,CNTS_200000000010956,스누피가든,제주특별자치도 제주시 구좌읍 송당리 2303-3 ,,스누피가든은 개성적인 모습을 자랑하는 피넛츠 캐릭터들을 만나 그들과 상호관계를 통해 공감과 힐링의 메시지를 얻을 수 있는 특별한 장소이다.,"반려동물동만 이용내용 수정운영시간 동절기 (10월~3월) 운영시간 09시 - 18시 입장마감 17시 하절기 (4월 ~9월) 운영시간 09시 - 19시 입장마감 18시 / 매주 수요일: 반려동물 데이로 반려동물 동반티켓 구매시 입장가능, 실내는 케이지 혹은 개모차 이용 必중형견, 대형견 입장가능 / 동물보호법에 따라 목줄 또는 가슴줄 길이 2미터 이내로 유지 / 배변봉투 필수 / 1인 1반려동물 입장 / 법적 맹견이 아닌 다른 견종에 대한 제한이나 차별 없음"
2122,CONT_000000000500373,소정방폭포,제주특별자치도 서귀포시 동홍동 234-8 ,,국내 유일의 해안 폭포,상세내용 삭제요망 (현재 관람가능함)태풍 힌남노로 구간별 파손이 심하며 입구 통제로 관람불가 (복구일정 미정)
2123,CNTS_000000000019652,김만덕객주,제주특별자치도 제주시 건입동 984-41 ,,제주 구도심에 있는 미니 민속촌,2023.03..09기준 주막 공사중으로 이용불가4월중 재오픈예정 
2000,CNTS_200000000007536,걸서악오름,제주특별자치도 서귀포시 남원읍 하례리 124 ,,"시원한 하례리 마을 풍경과 범섬, 섭섬 풍경을 한 번에 볼 수 있는 걸서악오름",[주소 변경요청][변경전] 제주특별자치도 서귀포시 남원읍 하례로 393[변경후] 서귀포시 남원읍 하례리 산 124번지 일대 
2001,CNTS_200000000014080,야크마을,제주특별자치도 서귀포시 색달동 1045 ,제주특별자치도 서귀포시 색달중앙로 162 (색달동) ,"제주의 자연 속에서 새로운 영감을 전하고, 삶의 균형을 회복할 수 있는 관광 휴양단지","1. 소개 내용지속 가능한 제주를 지향하는 친환경 숙박시설 비자트, 제주 식재료로 매력을 보여주는 레스토랑 두도, 감각적인 디저트와 포토존이 있는 카페 서울 앵무새, 제주 로컬 크리에이터들을 위한 공간 오앤디오 그라운드, 감귤밭이 아름다운 야크마을 둘레길 야크래가 조성되어 있는 야크마을로 여러분을 초대합니다.2.해시태그#중문 #럭셔리트레블인제주 #가족호텔3.지도 등록4. 여행지 - 숙박  에서 노출 안되는 점!5. 사진 수영장 크게 나온 사진 말고 위 사진으로 변경확인 부탁 드립니다. ㅠㅠ "
2008,CNTS_200000000010815,김택화미술관,제주특별자치도 제주시 조천읍 신흥리 227-5 ,,화가 김택화이 삶과 작품을 볼 수 있는 미술관,"[이용시간 변경]평일 : 10:00 ~ 18:00 , 주말 : 10:00 ~ 18:00 /매주 목요일 휴무 "
2032,CNTS_200000000012176,제주 중앙지하상가,제주특별자치도 제주시 일도일동 1425-3 ,,제주도 유일한 지하상가이자 쇼핑 중심지,"이용시간 변경연중무휴, 10:00 ~ 22:00 (점포별상이)"
2055,CONT_000000000500182,만장굴,제주특별자치도 제주시 구좌읍 월정리 산 41-5 ,,"세계적인 규모의 용암동굴, 유네스코 지정 세계자연유산","만장굴은 2023년 1월 27일부터 ""2023년 2월 1일까지"" 낙석으로 인한 점검으로 인해 임시 휴관합니다. 많은 양해 바랍니다.를  만장굴은 2023년 1월 27일부터 ""당분간""  낙석으로 인한 점검으로 인해 임시 휴관합니다. 많은 양해 바랍니다 으로 수정 부탁드립니다."
2062,CNTS_000000000018929,바당미술관,제주특별자치도 서귀포시 대정읍 일과리 1924-4 ,,모슬포 무릉리에 위치한 노부부가 운영하는 갤러리,상세내용 추가코로나로 인해 미술관 휴업 중  재개 계획 無_2023.01.17 기준
2063,CONT_000000000500651,테디베어사파리 테지움,제주특별자치도 제주시 애월읍 소길리 155-106 ,,"테디베어와 동물인형들을 직접만져보고,안아보고 함께 사진찍을수있는 체험형 오픈전시관","이용시간 및 요금 변경09:00 ~19:00 ( 매표마감 18:00 )성인 12,500원, 청소년 11,500원, 어린이(24개월~초등학생)10,500원"
2064,CONT_000000000500555,제주별빛누리공원[제한적운영중],제주특별자치도 제주시 오등동 10-34 ,,천체탐구와 천문학습의 장으로 청소년들에게 무한한 꿈과 희망을 심어줄 과학문화 공간,[제한적운영중] -> 기한 지남으로 삭제요청드립니다. 또한  2023.02.05 18:00~22:00 정월대보름 맞이하여 보름달 관측 이벤트 진행 예정입니다. 입장료 유료(동일) 사전예약없이 현장발매로 진행되며 문의처는 별빛누리공원 ☎064-728-8900 으로 확인됩니다.
2392,CONT_000000000500503,이랜드뮤지엄,제주특별자치도 제주시 한림해안로 530 ,,세계 최고가품인 오스카트로피 및 아카데미시상식 수상작들의 영화소품을 전시하는 박물관,
2403,CNTS_200000000010956,스누피가든,제주특별자치도 제주시 구좌읍 송당리 2303-3 ,,스누피가든은 개성적인 모습을 자랑하는 피넛츠 캐릭터들을 만나 그들과 상호관계를 통해 공감과 힐링의 메시지를 얻을 수 있는 특별한 장소이다.,"*상세 정보 / 이용 시간 변경 요청[상세 정보]매주 수요일만 반려동물 동반 가능함/ 수요일 : 반려동물 동반티켓 구매시 입장가능, 실내는 케이지 혹은 개모차 이용 필수 / 소형견, 중형견, 대형견 입장가능 / 동물보호법에 따라 목줄 또는 가슴줄 길이 2미터 이내로 유지 / 배변봉투 필수 / 1인 1반려동물 입장 / 법적 맹견이 아닌 다른 견종에 대한 제한이나 차별 없음[이용 시간]- 10월~3월: 09:00~18:00(입장마감 17:00)- 4월~ 9월: 09:00~19:00(입장마감 18:00)"
2410,CNTS_000000000020975,무릉곶자왈,제주특별자치도 서귀포시 대정읍 무릉리 산 1 ,,초보들도 쉽게 탐방할 수 있는 곳,연락처변경
2339,CONT_000000000500442,여미지식물원,제주특별자치도 서귀포시 색달동 2484-1 ,,마음의 안식을 주는 동양 최대의 온실 식물원,홈페이지 이용불가
2362,CNTS_200000000013150,훈데르트바서파크,제주특별자치도 제주시 우도면 연평리 1706-1 ,,"오스트리아 3대 화가이자 환경 운동가, 건축 치료사 ‘훈데르트바서' 의 예술과 건축 철학이 담긴 내추럴 아티스틱 테마파크입니다.","요금정보 변경유료,입장료 15,000원상세정보변경내전시관 09:30~18:00 (마지막 입장 17:00), 야외 전시장 09:30~21:40 관람가능- (훈데르트바서 뮤지엄): 1월~3월 09:30~18:00 / 4월~12월 09:30~21:00- (우도갤러리) 1월~3월 09:30~18:00 / 4월~12월 09:30~21:00"
2363,CNTS_000000000022173,제주 더팔팔농장,제주특별자치도 서귀포시 성산읍 신산리 1371-1 ,,"무화과, 한라봉, 레몬, 알로에 등을 하우스재배하고 있는 체험 농장",비짓제주에서 팔팔더농장 검색시 문의처가 없으시다는 제보가 있어 검토 후 처리 부탁드립니다. 
2372,CONT_000000000500733,서문공설시장,제주특별자치도 제주시 용담1동 135-9 ,,"제주의 마장동이라 불리우는 정육, 축산 전문 상설시장","* 이용시간 변경 요청드립니다.[변경전] 평일 : 09:00 ~ 20:00 , 주말 : 09:00 ~ 20:00[변경후] 연중무휴, 06:30~22:00 *점포별 상이"
2385,CNTS_000000000022158,유민미술관,제주특별자치도 서귀포시 성산읍 고성리 21 ,,유민미술관은 1894년부터 약 20여 년간 유럽 전역에서 일어났던 공예디자인 운동인 아르누보의 유리공예 작품을 전시하고 있다.,"상세정보변경매표마감 17시 / 매월 첫째주 화요일 휴관 / 오디오 가이드 1,000원 / 휘닉스제주 로비 앞 셔틀버스 무료"
2360,CONT_000000000500588,조랑말체험공원,제주특별자치도 서귀포시 표선면 가시리 3149-33 ,,"조랑말 박물관, 따라비 승마장, 마음카페, 아트숍, 야외광장 및 각종 체험프로그램 운영",홈페이지변경
2377,CONT_000000000500019,감귤박물관,제주특별자치도 서귀포시 신효동 산 4 ,,"감귤에 대한 모든 것을 보고, 느끼고, 체험할 수 있는 박물관","상세정보: 1월1일, 설날, 추석 /리모델링(2층 전시실)으로 2022.03.07~ 2023년 10월까지 부분개방 및 무료입장"
2378,CNTS_200000000008633,9.81 파크,제주특별자치도 제주시 애월읍 어음리 산 131 ,,제주도의 중심 한라산과 비양도를 품은 푸른 바다를 마주하는 실외 공간과 ‘iF 디자인 어워드’를 수상한 감각적인 실내 공간을 모두 경험할 수 있는 테마파크다. 제주의 자연과 어우러져 전혀 새로운 형태의 스마트하고 다채로운 어트랙션과 트렌디한 부대시설을 즐기며 사랑하는 이들과 잊지 못할 특별한 추억을 만들어보자.,"이용 시간평일 : 09:00 ~ 18:20 , 주말 : 09:00 ~ 18:20"
2379,CNTS_000000000022051,삼양검은모래축제,제주특별자치도 제주시 삼양2동 1965-1 ,,검은 모래가 반짝이는 여름 바다,연락처 변경 요망
2156,CONT_000000000500005,제주김녕미로공원,제주특별자치도 제주시 구좌읍 김녕리 산 16 ,,사계절 푸르른 랠란디나무로 이루어진 우리나라 최초의 미로공원,"[변경전]유료,입장료 일반 6,600원, 청소년 5,500원, 어린이 4,400원, 경로자,경증장애인 5,500원, 중증장애인 무료.[변경후]유료, 입장료 일반 7,700원, 청소년 6,600원, 어린이5,500원, 경로자 및 유공자 6,600원, 중증자애인 및 만70세이상 무료"
2159,CONT_000000000500409,아프리카박물관,제주특별자치도 서귀포시 대포동 1833 ,,"아프리카박물관은 아름다운 제주를 찾는 국내외 많은 관광객들에게 아프리카 문화를 보다 폭넓게 알리기 위하여 제주 중문관광단지에 그 터를 잡고 있다. 아프리카에 대한 잘못된 인식과 선입견을 바로 잡을 수 있는 방향을 제시하고, 아프리카 생활과 문화를 간접적으로나마 체험할 수 있는 문화공간이다.",홈페이지 변경
2193,CNTS_000000000020148,수월봉,제주특별자치도 제주시 한경면 고산리 3760 ,,차귀도로 떨어지는 낙조와 지질학의 교과서를 만나보자· 천연기념물 제513호· 올레12코스,"주요목적 기타에서 해설: 평일 09:00~16:30-> 연중무휴 *휴무: 1월 1일, 설, 추석/09:00~16:00 (점심 12:00~13:00)"
2214,CNTS_200000000008959,서프라이즈테마파크,제주특별자치도 제주시 조천읍 와흘리 2988 ,,문화예술계에서 주목하고 있는 재활용 소재를 활용한 정크아트(Junk Art) 작품을 테마로 조성된 관광지,"이용시간 및 요금정보변경09:00~21:30 (입장마감 20:30) 성인 12,000원 / 청소년 11,000원 / 소인 10,000원 *단체/도민할인가 홈페이지 참조"
2230,CONT_000000000500699,혼인지,제주특별자치도 서귀포시 성산읍 환해장성로 549 ,,"제주특별자치도 기념물 제 17호, 탐라의 시조인 삼신인(三神人)이 혼례를 올렸다는 장소· 서귀포시 성산읍 온평리· 제주특별자치도 기념물 제17호· 올레2코스",이용시간 정보 아래와 같이 수정 필요합니다.이용시간 : 이용 시간 제한 없음
2250,CNTS_200000000009011,허니문하우스,제주특별자치도 서귀포시 토평동 511 ,,유럽풍 건축물과 파노라마로 펼쳐지는 바다 경관을 보며 즐기는 베이커리 카페,"이용시간: 연중무휴, 10:00~18:30(라스트 오더 18:00)  로 변경요청 드립니다"
2255,CNTS_200000000008635,대유ATV수렵사격랜드,제주특별자치도 서귀포시 상예동 144 ,,110여만 평의 드넓은 대지에서 온몸으로 스릴을 느낄 수 있는 레저 스포츠.,"이용시간: 11~02월 09:00~17:30 / 03~04 월 09:00~18:00 / 05~08 월 09:00~18:30 / 09~10월 09:00~18:00* 성수기 (07.23~08.15) 09:00~19:00, 동절기 (12.08~12,31) 09:00~17:00/마지막 입장 영업 종료 30 분 전   이용요금: -1) 버기카 추가 운영(2021.06 월부터 진행된 체험 프로그램)* 운전면허증 소지 必, 운전경력 최소 1년 이상 必, 5 세이상 동승가능, 05~13 세까지 운전자외 보호자 동승 必패밀리코스(4인승/소요시간 30 분) 240.000 원산악코스(2인승 / 소요시간 30 분) 110.000 원오름코스(2인승 / 소요시간 20 분) 80.000 원"
2258,CNTS_000000000021429,다이나믹메이즈,제주특별자치도 서귀포시 표선면 성읍리 2381 ,,"다이나믹메이즈는 날씨에 구애받지 않고 즐기는 실내 액티비티다. 요즘 인기인 ‘방탈출’과 비슷한 콘셉트로 미로를 빠져나오기 위해 여러 가지 미션을 수행해야 한다. 가족이나 친구, 연인과 한 팀이 되어 서로 머리를 맞대 문제를 풀고 장애물을 뛰어넘으며 탈출구를 향해 달리는 색다른 재미를 느낄 수 있다. ",아래 주의사항 등재 요청합니다.리뉴얼 공사로 2023.05.14~07.15 휴장(재개일정 변동가능)
2262,CNTS_200000000009501,궁대오름(궁대악),제주특별자치도 서귀포시 성산읍 수산리 4711-1 ,,"오름의 모양새가 마치 활처럼 생기고, 오름 허리에 활(궁·弓)자 모양의 띠가 둘러져 있어 궁대오름, 한자로 궁대악(弓帶岳)으로 불리는 오름.",상세내용:  제주자연생태공원 내부로만 진입가능
2263,CONT_000000000500707,휴애리 자연생활공원,제주특별자치도 서귀포시 남원읍 신례리 2081 ,,자연속 동·식물들과 교감이 있는 체험형 자연생활공원,"[변경 전]평일 : 09:00 ~ 18:00 , 주말 : 09:00 ~ 18:00[변경 후]연중무휴 / 하절기(4~9월) 09:00-19:00(입장 마감 17:30) , 동절기(10~3월) 09:00-18:00(입장 마감 16:30)"
2264,CONT_000000000500707,휴애리 자연생활공원,제주특별자치도 서귀포시 남원읍 신례리 2081 ,,자연속 동·식물들과 교감이 있는 체험형 자연생활공원,"*상세정보 수정[변경 전]연중무휴 / 입장마감 : 하절기(4월~9월) 17:30, 동절기(10월~3월) 16:30 / 감귤체험 이용시 17:00까지 입장해야 체험가능 / 소형견 입장가능 / 동물보호법에 따라 목줄·가슴줄 길이 2미터 이내로 유지 리드줄 / 배변봉투 필수 반려견 7kg 미만 소형견만 입장 가능 카페 내부 입장불가 / 관람객이 많은 곳에서는 꼭 안고 다녀야 함[변경 후]감귤체험 이용시 16:00까지 입장해야 체험가능 / 소형견 입장가능 / 동물보호법에 따라 목줄·가슴줄 길이 2미터 이내로 유지 리드줄 / 배변봉투 필수 반려견 7kg 미만 소형견만 입장 가능 카페 내부 입장불가 / 관람객이 많은 곳에서는 꼭 안고 다녀야 함"
2268,CONT_000000000500438,에코랜드 테마파크,제주특별자치도 제주시 조천읍 대흘리 1221-1 ,,"기차를 타고 감상하는 곶자왈, 원시림 테마공원","*요금 정보 변경 요청[변경 전]유료,성인 14,000원 [변경 후]유료,성인 16,000원 / 청소년 13,000원 / 어린이 11,000원 / 경로 14,000원"
2164,CONT_000000000500232,백약이오름,제주특별자치도 서귀포시 표선면 성읍리 산 1 ,,"하늘로 향하는 길, 백약이오름",[출입제한 - 자연휴식년제 적용 중] 문구 삭제 요청 
2171,CONT_000000000500370,소암현중화기념관,제주특별자치도 서귀포시 소암로 15 ,,소암 현중화 선생의 삶과 예술이 숨쉬는 문화공간,홈페이지 변경https://culture.seogwipo.go.kr/soam/index.htm
2182,CNTS_200000000010958,아르떼뮤지엄,제주특별자치도 제주시 애월읍 어음리 1503 ,,"국내 최대의 몰입형 미디어 아트 뮤지엄. 스피커 제조공장이었던 건물을 리모델링하여 빛과 소리가 만드는 다이나믹한 미디어아트에 흠뻑 빠져보자,",연락처 및 사진 수정 요청사항 smartjto@gmail.com으로 송부드렸습니다. 확인 후 반영해주시면 감사하겠습니다! 감사합니다.
2227,CNTS_200000000013791,빛의 벙커,제주특별자치도 서귀포시 성산읍 고성리  2039-22 ,,성산에 숨겨져 있던 통신 벙커에서 열리는 미디어 아트 전시,이용시간 아래와 같이 수정 요청합니다.- 10:00~18:20 (입장마감 17:30) 
2251,CONT_000000000500457,오설록티뮤지엄,제주특별자치도 서귀포시 안덕면 서광리 1235-1 ,,"제주녹차문화의 중심, 차박물관과 카페테리아, 2016 KOREAT JEJU TOP 30 선정",이용시간 변경연중무휴 9:00~18:00
2260,CONT_000000000500551,제주목관아,제주특별자치도 제주시 관덕로 25 ,,조선시대 제주도 관청,"연락처 및 상세정보의 주차장 정보 수정 요청합니다.(기존) 주차장 : 제주시 관덕로7길 13 (변경) 주차장 ( 제주시 관덕로7길 13 ): 23.05.22부터 유물 발굴로  무기한 사용불가, 관덕정 서측 유료공영주차장 이용권장"
2265,CONT_000000000500336,제주아트서커스,제주특별자치도 서귀포시 안덕면 동광로 214 ,,국내 최초로 선보이는 7인 여전사 오토바이쇼,"*홈페이지 변경 요청 / 이용시간 변경 요청[변경 전]이용시간: 평일 : 10:30 ~ 16:30 , 주말 : 10:30 ~ 16:30[변경 후]이용시간: 1일 3회 (10:30,15:00,17:00) *매월 1회 휴무,일자 유동적으로 확인 후 이용"
2266,CONT_000000000501100,포도호텔,제주특별자치도 서귀포시 안덕면 상천리 산 62-3 ,,알알이 맺힌 제주의 아름다움,*연락처 변경 요청
2269,CONT_000000000500150,북촌돌하르방미술관,제주특별자치도 제주시 조천읍 북촌리 976 ,,"숲, 만남, 그리고 평화. 제주의 자연과 문화 그리고 예술이 함께 어우러진 감성공간.","*이용시간 변경 요청[변경 전]평일 : 09:00 ~ 18:00 , 주말 : 09:00 ~ 18:00[변경 후]- 하절기(4월~10월): 09:00~18:00 (30분 전 매표마감)- 동절기(11월~3월): 09:00~17:00 (30분 전 매표마감)"
2270,CONT_000000000500694,항파두리항몽유적지,제주특별자치도 제주시 애월읍 상귀리 1012 ,,고려시대 몽골의 침략에 끝까지 저항했던 삼별초가 최후까지 항전하여 호국충정의 혼을 일깨울수 있는 역사유적지,*연락처 수정 요청
2277,CNTS_000000000019946,귀빈사,제주특별자치도 제주시 구좌읍 송당리 2438 ,,제주 송당리에있는 이승만전대통령 별장 귀빈사 입니다.,이용 시간: 방문 최소 1일 전 문의처로 사전 예약 필요
